B086CS8YXB,2022,3,16,1,Secret Hair Growth,5.0 out of 5 stars,58 people found this helpful,"Reviewed in the United States on January 1, 2021",Amy H,,Verified Purchase,,"My goal for this product was to achieve hair growth which may not be your primary motivation. About two years ago I noticed that my hair was thinning badly. I’m going to be 58 next month and I have left  what used to constitute One pigtail that’s now a single ponytail.  . I had the classic male pattern thinning above my temples and with my bangs. I was completely freaking out as my hair is kind of my signature feature. It’s always been wavy and fine but pretty. I also let my silver grow out about four years ago and the lack of processing has made my hair healthy,  shiny and soft. At the end of 2018 I embarked on this research project about how to re-grow my hair and keep what I have from hair care products, the way that I treat my hair,  and nutrition. They said not to keep your hair tightly wrapped up and to let it flow, that washing your hair every other day was better because it removes buildup on the scalp, so I dumped the Pantene and tried the biotin shampoo starting two years ago. At the same time I start Taking the 5000 mg of biotin pills for hair and nails from natures bounty that I got at Costco. And at the beginning of 2019 I research which vitamins and foods to eat which include anything high in vitamin A like red and yellow bell peppers, red cabbage, spinach, Sweet potatoes, Butternut squash and cauliflower… along with almonds sunflower seeds salmon eggs and Greek yogurt.  I bough this Nizoral In April 2019. As of today I have an entire undercoat of fine new hair but it’s only about 4 inches which leads me to believe that the biotin shampoo really didn’t affect things all that much. Four Inches of hair growth is about 8 months. So I went back on to Amazon to see you when I first bought this  dandruff shampoo and lo and behold it was in April which is eight months today - January 1, 2021. I do believe that nutrition is key along with stress management and sleep course. But I find it really interesting that I’m able to trace the number of inches to when I bought this shampoo.  I don’t know if it’s 100% direct correlation but I can testify that is working for me in the hair growth department. I also found a different hair growth vitamin that I’m going to start using next week.  It’s called Hair La Vie.  Last observation. I did use Nioxin 3  for a number of years and I don’t think it worked as well as the shampoo coupled with the nutrition. Because I still had a lot of hair thinning of the temples which is now filling in considerably. And also Nioxin dries your hair out badly. I like alternating between the biotin shampoo and this dandruff shampoo because the Biotin Shampoo is less drying than Nizoral.  The key is to get it worked up into your scalp really well and just let it sit there for a while so you have to like use it less often. I hope this helps you I know How agonizing it is to lose your hair especially when you’re a woman. Good luck",2022-03-16 00:16:03.426850
B086CS8YXB,2022,3,16,2,Dandruff-free in 3 washes,5.0 out of 5 stars,27 people found this helpful,"Reviewed in the United States on July 26, 2020",Katy ,,Verified Purchase,,"I’ve been using this shampoo at every wash for at least a month now. After about 3 washes, my dandruff was entirely gone and I’ve continued to use this product to maintain my dandruff-free scalp. I have sensitive skin, so Head and Shoulders gave me hives, but this product never has. It has a gentle scent and it comes out dark blue, which is fun. I read that it’s recommended to leave this product in for 5 minutes to really let the medication set in, I usually only leave it in for 2-3 minutes, and have seen great results.",2022-03-16 00:16:03.426850
B086CS8YXB,2022,3,16,3,DUDE SERIOUSLY WORTH THE MONEY,5.0 out of 5 stars,27 people found this helpful,"Reviewed in the United States on September 21, 2020",Maria R,,Verified Purchase,,"I have struggled with dandruff for about 4 years. I had only ever used head and shoulders. It would work for about a few days but THIS ? 1000X yes. I am a latinx woman, with thick thick thick hair. I was desperate to find something to help. This has actually changed my life in the way I think about myself, the way I go out. Because now I'm not paranoid about flakes. I fix my hair and curl it more often now because my scalp is so much healthier. Just let is soak in, dont let it get in your eyes and always do a second wash like the bottle says. It's an amazing product and I wish I was sponsored by them. I would go by this product for the rest of my life. I havnt seen a flake in over 3 weeks and that's a win for me. And YES yes it only so many days after. I had a horrible scalp problem and its zapped it away. Its strong so dont be wild with it.",2022-03-16 00:16:03.426850
B086CS8YXB,2022,3,16,4,Best purchase EVER!!!,5.0 out of 5 stars,14 people found this helpful,"Reviewed in the United States on December 12, 2020",S,,Verified Purchase,,"I’m keeping it 100%!! I have been struggling with severe itchy scalp and dandruff for over 1 year. I went to my local dermatologist and they recommended a shampoo that only lasted 3 weeks and right away after I ran out everything came back.... desperately looking for other solutions i searched on amazon the main ingredient of the shampoo to find other products and BAM! I found it! and im so beyond happy  that I got it. My scalp has never felt healthier, it’s no longer itchy, or irritated and the best part is no more stubborn  dandruff!!!! 10/10 recommend!!",2022-03-16 00:16:03.426850
B086CS8YXB,2022,3,16,5,It works!,5.0 out of 5 stars,10 people found this helpful,"Reviewed in the United States on November 12, 2020",Tyler,,Verified Purchase,,"This is the ONLY shampoo I've found so far that actually has treated my dandruff. Selson blue worked ok, but if I went one day without using it, it would come back. Head and shoulders I think actually made it worse. This product has COMPLETELY taken away my dandruff. I use it at least every other day and teatree oil shampoo on other days. Best part is that it not only works but actually smells good, compared to Selson Blue which IMO smells pretty bad. I am VERY thankful for this product. It has greatly improved my life because now i don't have to deal with dandruff.",2022-03-16 00:16:03.426850
B086CS8YXB,2022,3,16,6,treated my dermatillomania,5.0 out of 5 stars,7 people found this helpful,"Reviewed in the United States on October 20, 2020",Solt,,Verified Purchase,,fantastic. never thought i would find something to treat my itchy head. I compulsively would touched/picked my scalp for the longest. Then my head was always itchy and it seemed to be an unbreakable cycle.,2022-03-16 00:16:03.426850
B0099EHM86,2022,3,16,1,Absolutely worth the money!,5.0 out of 5 stars,181 people found this helpful,"Reviewed in the United States on June 3, 2018",Monica Flores,,Verified Purchase,,"I had been having such a difficult time getting rid of dry patches on my scalp. They were so bad I could actually scrape chunks of dry skin from my scalp, and was super itchy, and by scratching them, it had left flakes on my shoulders. I have literally tried everything on the store shelves to get some relief with absolutely no results or relief. So at this point I was willing to try just about anything. So after searching here on Amazon I came across this shampoo, read the reviews, mostly good and a few bad. I bought my bottle about a month ago, and have been using it faithfully everyday. I feel comfortable now giving this review. I have to be totally honest, I was skeptical, but it has made a huge change in my scalp health. I have no more flakes on my dark shirts, and the itching has totally gone away. I still have a couple of patches I’m still working on, but wow, what a difference. Some here have said the smell is pleasant, but I wouldn’t say pleasant, maybe earthy, kind of like wet potting soil. Although this has calmed my scalp, my hair ends are very frizzy now, worse than usual, so I just use an intense conditioner now. My hair is 99% white and gets dry and frizzy naturally any way. I’m very pleased with this product and plan to buy another bottle. Don’t expect instant results, give it a good three to four weeks like I did.",2022-03-16 00:16:10.025739
B0099EHM86,2022,3,16,2,This actually works very well....,5.0 out of 5 stars,173 people found this helpful,"Reviewed in the United States on April 17, 2018",Just Louie....,,Verified Purchase,,"I've had problems with dandruff related to sebhoric dermatitis since I was a kid 40 plus years ago. Nothing I've tried has helped very much and that includes the sulfur based products, ketocanozole Nizoral, etc. I've been using this almost daily for a month now and my scalp is doing better than it ever had other than when I was in the army and had no hair. This stuff works wonders and I highly recommend it. Believe me, I know the embarrassment of dandruff, and the flakes as well as that intense burning and itching that comes with the dermatitis. This stuff helps, at least in my case, immensely. I highly recommend it. Take care.",2022-03-16 00:16:10.025739
B0099EHM86,2022,3,16,3,Excellent shampoo!,5.0 out of 5 stars,120 people found this helpful,"Reviewed in the United States on December 17, 2018",Patrick A. Thomas,,Verified Purchase,,"This is excellent shampoo! I have struggled with severe dry scalp for over a year. I am an African-American woman with very curly hair and the medicated prescription shampoo my dermatologist prescribed worked for scalp health, but was too drying for my hair.  This shampoo totallly impresses me by removing dry scalp gently, cleaning and conditioning my hair well, AND it smells wonderful!  I tried the conditioner also, and it’s nice.  But, the shampoo works on it’s own to clean and condition.  Get the conditioner if you want a cute gift set for someone. It’s a nice extra, but the shampoo really can work solo.  I have been using the shampoo for 4 months.",2022-03-16 00:16:10.025739
B0099EHM86,2022,3,16,4,Does not work!,1.0 out of 5 stars,106 people found this helpful,"Reviewed in the United States on December 26, 2018",America,,Verified Purchase,,"This product did not work for me. I have really bad dandruff and nothing seemed to for me NOTHING, but I read some reviews saying it works so I gave it a try. Did not work! Has a really strong smell does not sell good at all! My head still itches and it actually makes my dandruff go into big clumps on my head.",2022-03-16 00:16:10.025739
B0099EHM86,2022,3,16,5,Amazing for scalp break outs!,5.0 out of 5 stars,100 people found this helpful,"Reviewed in the United States on June 10, 2018",*Nerd Alert*,,Verified Purchase,,I bought this shampoo because I have curly/frizzy/color treated hair and I had started breaking out with painful pimples on my scalp and I had heard that tea tree essential oil was great for that.,2022-03-16 00:16:10.025739
B0099EHM86,2022,3,16,6,Maple Holistics is nailing their shampoo game.,5.0 out of 5 stars,95 people found this helpful,"Reviewed in the United States on January 15, 2018",Dani,,Verified Purchase,,"I have searched for a long time to find the best product for my problematic scalp. Through some cruel twist of fate it manages to somehow be simultaneously oily and dry. This past year I have exclusively used this tea tree oil shampoo in tandem with maple holistic's ""degrease shampoo"" and have seen a marked improvement in my scalp eczema and the cleanliness of my hair. With this combo I can go 3 days without  washing my hair and my dandruff is all but gone. My hair looks healthy, shiny and instagram worthy. <3",2022-03-16 00:16:10.025739
B0099EHM86,2022,3,16,7,Not consistent. Ingredient list got much longer with sodium this and that. Oils are very last ingredient out of 20 something,2.0 out of 5 stars,926 people found this helpful,"Reviewed in the United States on April 8, 2015",Scriblerus,,Verified Purchase,,Five stars. Feels clean and helps with break outs near my hair line. I got it in hopes of reducing excessive shedding (TE) and to help regrow lost hair. I don't know that it has helped at all with the regrowth but it hasn't hurt and is non irritating. I have not liked the anti hair loss shampoos I have tried so I plan to stick with this and continue healthy eating and supplements. I have sensitive skin and fine hair; it works well for me.,2022-03-16 00:16:10.025739
B009DU4QYE,2022,3,16,1,Do not recommend,1.0 out of 5 stars,91 people found this helpful,"Reviewed in the United States on November 5, 2020",Amazon Customer,,Verified Purchase,,"This did not work for me at all. Obviously everyone’s hair is different but I was expecting much more based off the reviews. After I purchased, I realized that they give you a free bottle if you leave a positive review, which is probably why there are so many. The consistency is a bit thick but that’s fine, the scent is fine, but it just didn’t do a single thing for my oily hair. Still oily later that day or the next day, even after I used it for 30 days. Will not purchase again.",2022-03-16 00:16:17.286905
B009DU4QYE,2022,3,16,2,"Looking for something to help with greasy, color treated hair? You found it.",5.0 out of 5 stars,153 people found this helpful,"Reviewed in the United States on January 18, 2018",Lindsay,,Verified Purchase,,"I have been excited to leave a review for this product! I dye my hair but unfortunately have a greasy scalp. It's hard to find a shampoo that helps greasy hair that is color treated. THIS IS IT. My color doesn't fall out and it helps with greasy hair! Obviously, there is no product that can completely eliminate the problem of having greasy hair. It's important to have realistic expectations. Try using this product for a month and then evaluate your results. I still need to use dry shampoo, but I have tried a lot of products and have found nothing better than this. It's also important to follow the instructions. Massage slowly into scalp and let sit for 2-3 minutes. Repeat process. You must do this process twice or you will not see the results you're looking for. You'll notice the first time you put it in, there will be little to no foam/soap. The second time, you'll see LOTS of foam/soap. This is how you know it's working! All in all, I think this is great product to help greasy hair and to maintain your color.",2022-03-16 00:16:17.286905
B009DU4QYE,2022,3,16,3,Can now wash fine hair every other day instead of every day. Great product.,5.0 out of 5 stars,155 people found this helpful,"Reviewed in the United States on August 29, 2017",Hullomomma,,Verified Purchase,,"I was skeptical about this shampoo, since a lot of the reviews seemed to be overly enthusiastic and stated that they were genuine (the lady doth protest too much?) but it really is a great product.",2022-03-16 00:16:17.286905
B009DU4QYE,2022,3,16,4,The jury is still out on this shampoo. Pros and con....,3.0 out of 5 stars,106 people found this helpful,"Reviewed in the United States on September 29, 2017",Christian Keyz,,Verified Purchase,,"It's frustrating looking at reviews on Amazon nowadays because very few reviews seem authentic. My honest review of this shampoo is that it's fine. I'm a guy with short hair, so I only need to use a small amount of this shampoo. I leave it on for the 2-3 minutes suggested, but do not do a second application and rinse because it really does not seem necessary. The product succeeds in leaving my hair feeling clean and does seem to work at doing some degreasing. You MUST use conditioner on the tips of your hair every time after using this shampoo, because it does leave your hair feeling very dry. I'm also not a big fan of the smell, but it's not bad, just not something I would ever buy or wear for the scent alone. Luckily, my conditioner and other hair product take care of that. It's only been a week, so I will come back when it's been a few more weeks, but for now, it's not made anything worse, but it will take some more results for me to come back for a second purchase when I use this bottle up.",2022-03-16 00:16:17.286905
B009DU4QYE,2022,3,16,5,Disappointed.,2.0 out of 5 stars,70 people found this helpful,"Reviewed in the United States on March 8, 2018",aarykka,,Verified Purchase,,"This shampoo may be good for some people but for me, I hated it. I've always had an oily scalp and hair and was tired of constantly washing it because of that reason but I've learned that we need the oils in our skin to keep our scalps moisturized. I used this shampoo for two weeks and it stripped my hair of all the oils and left my scalp feeling ridiculously dry. My scalp broke out in these weird clump rashes that scabbed and it's been tough to get it back to normal. Though it sucks having oily scalp and hair, using this shampoo has taught me that we need the oils in our skin to keep our scalps moisturized so it doesn't turn into rash and dandruff hell.",2022-03-16 00:16:17.286905
B009DU4QYE,2022,3,16,6,This shampoo helped when others did not,5.0 out of 5 stars,33 people found this helpful,"Reviewed in the United States on March 1, 2020",Amazon Customer,,Verified Purchase,,"My hair was super oily from anesthesia after having two surgeries very close together.  Even adding vinegar to my regular shampoo did not help much. I purchased a shampoo at the drugstore that was for oily hair. It was no better. I added vinegar and baking soda to it with a small degree of success. I decided to research Amazon and see what I could find. I found many that claimed they would help. I read the reviews. Very mixed!! What do you believe?? I narrowed it down to The natural Solution Degrease Shampoo. I like the fact that it was paraben and sulfate free. I love essential oils and know the properties of them, so I was glad they were included. The shampoo is creamy with an slight earthy smell. It does not take much so it is long lasting. It did the job for me. My thick straight hair is back to normal. I would recommend",2022-03-16 00:16:17.286905
B009DU4QYE,2022,3,16,7,Worse than any shampoo I have tried in the past.,1.0 out of 5 stars,45 people found this helpful,"Reviewed in the United States on September 1, 2018",polorgirl,,Verified Purchase,,"I have to wash my hair daily. It’s bad and I have tried many shampoos, both cheap and expensive ones to combat the problem. I’ve tried not washing it for a few days but that doesn’t help either. I was excited to find this and after reading so many good reviews I was sure this would work but I am really disappointed. I have tried using this for several days, following the instructions every time. My hair doesn’t even make it through the day before it starts looking greasy. By the end of the day it’s so greasy it looks wet down to the tips. A $2 bottle of Sauve Daily Clarifying does a better job. As for smell, it’s smells just like any other soap you would imagine to find in a natural products store.... in other words, not too good. I will not recommend this to others.",2022-03-16 00:16:17.286905
B01LTIAU9W,2022,3,16,1,An Amazing Product,5.0 out of 5 stars,41 people found this helpful,"Reviewed in the United States on September 18, 2019",Shashi Banda,,Verified Purchase,,"For anyone that has frizzy, curly, or even wavy hair I would definitely recommend this product. I have wavy hair and I always struggled with my hair being frizzy and dry. Not only does the shampoo work, but without even using the conditioner Cantu works amazingly! This shampoo also minimizes volume, but still makes ur hair shine! I would 10/10 recommend this to anyone",2022-03-16 00:16:23.754916
B01LTIAU9W,2022,3,16,2,Love this product,5.0 out of 5 stars,34 people found this helpful,"Reviewed in the United States on April 1, 2019",Desiree ,,Verified Purchase,,I absolutely love this shampoo. It really gets all the dirt out of my 4c hair. It lathers up pretty nicely which I like. After lathering I go in with my scrubber and it feels amazing! I would definitely suggest this product for anyone who loves a squeaky clean scalp!,2022-03-16 00:16:23.754916
B01LTIAU9W,2022,3,16,3,Love Cantu!,5.0 out of 5 stars,13 people found this helpful,"Reviewed in the United States on January 6, 2021",Duckie,,Verified Purchase,,"I'm a loyal Cantu customer, it's all I use on my hair. I love the coconut scent and it's super great on my hair. I'm starting my curly/wavy journey and when I saw the review for Cantu by Manes by Mell, I got the shampoo, conditioner and curl activating cream first and I was hooked. The prices are great, I now have the conditioning mask, leave in conditioner and growth treatment too. My hair is fine so I love the added protection.",2022-03-16 00:16:23.754916
B01LTIAU9W,2022,3,16,4,Wish I bought this years ago!,5.0 out of 5 stars,17 people found this helpful,"Reviewed in the United States on June 18, 2019",N. C. Schmidt,,Verified Purchase,,"I have very curly hair and this shampoo provides cleansing and moisturizing. Even my daughter who has straight, oily hair (obviously she didn't get that from my side) finds this cleansing shampoo prevents frizzing and her hair is not oily till the next day.  Cantu Shampoo, which is the best.",2022-03-16 00:16:23.754916
B01LTIAU9W,2022,3,16,5,Holy Grail Curly Girl Shampoo,5.0 out of 5 stars,9 people found this helpful,"Reviewed in the United States on December 3, 2020",Melissa Smith,,Verified Purchase,,"I’ve tried a lot - A LOT - of curly hair products since i started wearing my hair wavy last year. This is one of my holy grail products - it is so gentle but it really feels like it gets my hair good & clean. The scent is great and not overpowering. I use it on my fine, wavy hair once or twice a week, and on the other days that I get my hair wet I’ll use As I Am cowash. (The conditioner that goes with this cleanser is a good conditioner, too.)",2022-03-16 00:16:23.754916
B01LTIAU9W,2022,3,16,6,This works great on hair that is prone to frizzy and static,5.0 out of 5 stars,28 people found this helpful,"Reviewed in the United States on February 3, 2018",Jess ,,Verified Purchase,,This works great on hair that is prone to frizzy and static. Love it and you don't need much for it to clean well! One bottle lasts about a month on my shoulder length wavy hair.,2022-03-16 00:16:23.754916
B01LTIAU9W,2022,3,16,7,Two Stars,2.0 out of 5 stars,17 people found this helpful,"Reviewed in the United States on October 21, 2018",Kitty Ink,,Verified Purchase,,Tried using a few times and left my hair tangled and feeling stripped raw.,2022-03-16 00:16:23.754916
B01LTIAU9W,2022,3,16,8,I like it,4.0 out of 5 stars,16 people found this helpful,"Reviewed in the United States on November 16, 2018",Madisyn,,Verified Purchase,,"I love the smell, it has great lather (a little goes a long way). My hair (4a/b) does feel clean after but not completely stripped of moisture. there is nothing wrong with it, i just dont think its quite 5 stars.",2022-03-16 00:16:23.754916
B09H3RK75S,2022,3,16,1,Works great,5.0 out of 5 stars,4 people found this helpful,"Reviewed in the United States on January 15, 2022",Danny,"
        VINE VOICE",Verified Purchase,Vine Customer Review of Free Product,This conditioner pack is excellent.,2022-03-16 00:16:29.870769
B09H3RK75S,2022,3,16,2,It really works,5.0 out of 5 stars,2 people found this helpful,"Reviewed in the United States on February 5, 2022",John Land,,Verified Purchase,,The shampoo really works and makes my hair feel thicker.,2022-03-16 00:16:29.870769
B09H3RK75S,2022,3,16,3,Works great,5.0 out of 5 stars,,"Reviewed in the United States on March 9, 2022",Brian Edwards,,Verified Purchase,,"I’m having good luck with it, works as designed",2022-03-16 00:16:29.870769
B09H3RK75S,2022,3,16,4,Love it,5.0 out of 5 stars,,"Reviewed in the United States on March 11, 2022",John Isamov,,Verified Purchase,,Great shampoo for everyday use.,2022-03-16 00:16:29.870769
B09H3RK75S,2022,3,16,5,Great Product,5.0 out of 5 stars,,"Reviewed in the United States on March 13, 2022",John D,,Verified Purchase,,"Finally, the search for my shampoo ends.",2022-03-16 00:16:29.870769
B09H3RK75S,2022,3,16,6,Great Value and Seems To Work Well In Sensitive Heads,5.0 out of 5 stars,4 people found this helpful,"Reviewed in the United States on February 4, 2022",Glamorous Gem Review Haven,"
        VINE VOICE",,Vine Customer Review of Free Product,"Hi, it's Glamorous Gem, hope you all are having a wonderful day,",2022-03-16 00:16:29.870769
B09H3RK75S,2022,3,16,7,"Really Nice Thickening Results, Scent Is Not As Nice.",4.0 out of 5 stars,3 people found this helpful,"Reviewed in the United States on February 6, 2022",TravelLovers1015,"
        VINE VOICE",,Vine Customer Review of Free Product,"I have been wanting to try Hims for a while and see if it was worth the hype and for the most part it is. You get two 6.4 ounce bottles of the shampoo. They both shampoos and not a shampoo and conditioner. A little goes a long way, so you will get months of use out of these two bottles. I like how it lathers well without having to use too much product.",2022-03-16 00:16:29.870769
B09H3RK75S,2022,3,16,8,It makes hair fuller,4.0 out of 5 stars,3 people found this helpful,"Reviewed in the United States on January 7, 2022",TheTerrorBeyond,,,Vine Customer Review of Free Product,"This is for a two pack of shampoo at $24.99, so a little over $12 a bottle. The good news is that you don't need to use a lot of the product to get results.",2022-03-16 00:16:29.870769
