B095M11PV8,2022,3,16,1,Not worth the money!!!!,1.0 out of 5 stars,4 people found this helpful,"Reviewed in the United States on November 9, 2021",JRD,,Verified Purchase,,I paid 16.00 for 14 size sample lipsticks that are Equivalent to putting colored wax on my lips. This product is crap!,2022-03-16 04:23:38.130492
B095M11PV8,2022,3,16,2,Upset,1.0 out of 5 stars,,"Reviewed in the United States on February 26, 2022",ARLENE,,Verified Purchase,,I got the lipstick’s with the case broken I really wanted to keep it for my self but the case was broken and that was one of the reason why I bought it ! I contacted them they said they would send one to me free of charge I was happy 😊 then they emailed that they where going to refund me instead 🥺 I really wanted this ! It was cute ☺️ but I guess it was not meant to be for me 😂🤣,2022-03-16 04:23:38.130492
B095M11PV8,2022,3,16,3,Very pigmented,5.0 out of 5 stars,,"Reviewed in the United States on December 27, 2021",V0616,,Verified Purchase,,I bought these for my 13 YO daughter and she was absolutely thrilled with all of them. They are so cute and fun and colors are so pigmented. Be careful applying them though. The lipsticks do not retract so they can break off easily. This happened to my daughter with one of them,2022-03-16 04:23:38.130492
B095M11PV8,2022,3,16,4,Very cute and pigmented,5.0 out of 5 stars,,"Reviewed in the United States on March 3, 2022",Sydney,,Verified Purchase,,"It is pretty small for $17 but I tend to never finish any of my lipsticks so this is fine with me. The color is very pretty and pigmented. I love it. It’s cute, pigmented and is small enough to bring in your little bag/purse.",2022-03-16 04:23:38.130492
B095M11PV8,2022,3,16,5,Does not last long.,2.0 out of 5 stars,3 people found this helpful,"Reviewed in the United States on September 3, 2021",pratima,,Verified Purchase,,Colors are good but it does not last long.,2022-03-16 04:23:38.130492
B095M11PV8,2022,3,16,6,Ever so cute,5.0 out of 5 stars,One person found this helpful,"Reviewed in the United States on November 2, 2021",Lillie,,Verified Purchase,,"This is the cutest idea & great for my teen daughter, keeps her friends from getting in my lips sticks",2022-03-16 04:23:38.130492
B095M11PV8,2022,3,16,7,Lip smacked,4.0 out of 5 stars,,"Reviewed in the United States on March 11, 2022",Duane Allen,,Verified Purchase,,"They are so cute my daughter loves it but the only thing I don't like is that when you close it the lip stick rubs on the cap, not enough room.",2022-03-16 04:23:38.130492
B095M11PV8,2022,3,16,8,Color confusion,4.0 out of 5 stars,One person found this helpful,"Reviewed in the United States on December 6, 2021",andrew holaway,,Verified Purchase,,Love this. Just wish I knew which ones contained which colors,2022-03-16 04:23:38.130492
