B00ZPQ129C,2022,3,16,2,Smells like Golden Girls,3.0 out of 5 stars,18 people found this helpful,"Reviewed in the United States on February 19, 2021",RubyxCube,,Verified Purchase,,"I’m a healthcare worker on the frontline so I need to decontaminate myself daily. Well, my hair is suffering from repeat washings - my strands are devoid of all moisture. What an expensive attempt to replenish my dry, fragile hair. It lathered well in hard water. I felt my hair was clean. But my hair felt neither nourished nor healthier after its use. I don’t know what to do with the rest of the product. I suppose I could wash my car with it. Be advised: your hair will smell like your friend’s grandma. Not YOUR grandma...your friend’s. So enjoy your clean, brittle hair with some Werther’s Originals. Don’t forget to tell your Nana you love her.",2022-03-16 00:21:19.917731
B00ZPQ129C,2022,3,16,3,Beats Aveda's Dry Remedy by a mile!,5.0 out of 5 stars,54 people found this helpful,"Reviewed in the United States on December 30, 2017",Corrina Milito,,Verified Purchase,,I love all things Davines. I've been using Momo for at least ten years. In the last couple of years I've noticed my hair getting progressively dryer in the winters. My stylist recommended Aveda's Dry Remedy which I just don't like. It leaves my hair weighted down and greasy. I hadn't used Oi in years but decided I'd give it a try. It's perfect. My hair feels nourished and soft. The broken flyaways are smooth and it is shiny and healthy looking again.,2022-03-16 00:21:19.917731
B00ZPQ129C,2022,3,16,4,My All Time Favorite Shampoo,5.0 out of 5 stars,54 people found this helpful,"Reviewed in the United States on October 16, 2017",L.W.,,Verified Purchase,,"This is the best shampoo I have ever used. I’m a serial shampoo buyer, always looking for a shampoo that will fit my hair’s needs. I have fine, wavy hair.  Most shampoos leave my hair feeling limp & stripped of its naturals oils or limp & greasy. This shampoo hits the right balance. It leaves my hair feeling so soft, looks voluminous, healthy and shiny. Not too dry or too greasy. The smell is amazing, I have never smelled anything like this shampoo. I bought this shampoo for my mother as well, and she has thick oily curly hair and she loves it as well. Neither of us have tried another shampoo since.",2022-03-16 00:21:19.917731
B00ZPQ129C,2022,3,16,5,Product not even full!,1.0 out of 5 stars,32 people found this helpful,"Reviewed in the United States on July 1, 2019",JN,,Verified Purchase,,This is what came today.. seriously?? Not even full and expensive.,2022-03-16 00:21:19.917731
B00ZPQ129C,2022,3,16,6,shampoo performs nicely and goes well with the conditioner from the same product line,5.0 out of 5 stars,33 people found this helpful,"Reviewed in the United States on June 14, 2017",Sneaky Burrito,,Verified Purchase,,"I got a sample of this in a subscription box and decided I liked it well enough to buy it in full size.  I've been using it for a few days, along with the conditioner from the same product line, and I am really happy with it.",2022-03-16 00:21:19.917731
B00ZPQ129C,2022,3,16,7,Best shampoo ever!,5.0 out of 5 stars,31 people found this helpful,"Reviewed in the United States on June 3, 2017",Sue Ann,,Verified Purchase,,"Best shampoo ever.  Seriously.  My hair is in fabulous condition now.  Love all the Oi products.  I have very dry color treated hair, and Oi helps keep it smooth and silky.  Great smell too.  I always follow up with the Oi conditioner as well.  Probably too much for oily hair, but great for dry hair.",2022-03-16 00:21:19.917731
B00ZPQ129C,2022,3,16,8,A little dab will do,5.0 out of 5 stars,22 people found this helpful,"Reviewed in the United States on May 1, 2018",savvyshopper,,Verified Purchase,,I've tried zillions of shampoos for my color treated somewhat dry hair. Most make my hair frizzy or have too much lather in them.,2022-03-16 00:21:19.917731
B001BAFQOS,2022,3,16,1,Found my go-to mousse!!,5.0 out of 5 stars,224 people found this helpful,"Reviewed in the United States on July 13, 2020",Pamela King,,Verified Purchase,,"Over the years I’ve used hundreds of different mousse products with predictable disappointing results.  I have very fine as well as thin hair that will flatten out within an hour due to the weight of the product.  Not this time!!!  At this price, I tried it due to the description...figuring it would be same as usual.  Not at all—my hair is fuller, shinier and feels amazing to the touch.  If you have my hair type ( sorry, it’s in the genes) try this.  You will not be disappointed.",2022-03-16 00:21:26.703206
B001BAFQOS,2022,3,16,2,Works Great on Thinning Silver Hair!,5.0 out of 5 stars,216 people found this helpful,"Reviewed in the United States on September 5, 2020",Melinda,,Verified Purchase,,"I will soon be 70, and my hair is thinning silver hair.  I used this on my bangs and the front sides of my hair, applying it generously to the roots as it said -- and then some.  I dried it, and WOW, my hair, which used to lay flat after drying, was raised from the roots and stayed together, looking like much thicker hair.  To my surprise, the next morning, after sleeping, it looked just as good, and day three and four also!  Cannot praise it enough!",2022-03-16 00:21:26.703206
B001BAFQOS,2022,3,16,3,Please read the full EDITED review,1.0 out of 5 stars,137 people found this helpful,"Reviewed in the United States on February 2, 2021",sladjy,,Verified Purchase,,"I love EVERYTHING about this product! After doing some research, reading millions of reviews, I decided to give this mousse a try. I am so glad I did! I have fine hair, and it always looks flat. Finally I feel like I have full head of hair!! Thank you John Frieda!! It doesn’t stiffen the hair. It leaves it very nice, voluminous and manageable. Love it!",2022-03-16 00:21:26.703206
B001BAFQOS,2022,3,16,4,Best ever!,5.0 out of 5 stars,67 people found this helpful,"Reviewed in the United States on February 13, 2021",Debi,,Verified Purchase,,"I have used just about every product for fine hair to get volume there is - this is absolutely the BEST I've found! I have used very pricey stuff, cheap stuff, whatever would promise to do it and none of it worked. At best you would get a little volume but it would be gone in an hour. This smells fresh, you don't have use a lot, it doesn't seem to build up and it holds. I have baby fine hair but a lot of it so the weight of it pulls it down. Right now it is about shoulder length. Just a heads up I am 68, my hair is silver & white and still as fine and soft as it's always been so I'm not new to the game. Amazing stuff!",2022-03-16 00:21:26.703206
B001BAFQOS,2022,3,16,5,Not the real deal?,1.0 out of 5 stars,96 people found this helpful,"Reviewed in the United States on April 11, 2020",Rebecca,,Verified Purchase,,"I have used this product for years and love it. But my recent purchases have been disappointing to say the least. I used it and right away something was different. The product seems watered down. Normally I spray it in my hair and let it set a few minutes. It gets a little ""crunchy"" which is the way it should. The bottles that I just bought don't do that. My hair doesn't get any volume at all. My opinion is that it has been altered somewhere😒. No i will not purchase this again from this site. I will buy it from a drug store and pay more but at least I will get the full product and not some watered down junk.",2022-03-16 00:21:26.703206
B001BAFQOS,2022,3,16,6,Used to be good...,1.0 out of 5 stars,206 people found this helpful,"Reviewed in the United States on February 7, 2018",A. Thomasson,,Verified Purchase,,"I have fine hair that is difficult to hold a style without the right hairspray. John Frieda Luxurious Volume had been my go to for years. It held a style without being sticky and could be brushed out easily.  Alas, that is no more.",2022-03-16 00:21:26.703206
B001BAFQOS,2022,3,16,7,get this ladies!!!,5.0 out of 5 stars,302 people found this helpful,"Reviewed in the United States on April 22, 2016",kayla frazee,,Verified Purchase,,this stuff is wonderful. let me start by saying I have the flattest hair ever and this did the trick I'm guessing as good as or better than anything professional I've tried for volume. let me tell you a little more:,2022-03-16 00:21:26.703206
B001BAFQOS,2022,3,16,8,Never Again,1.0 out of 5 stars,47 people found this helpful,"Reviewed in the United States on May 23, 2019",Jo-Jo '77,,Verified Purchase,,"I'm a dude. Been using this spray for 6 years now because there's almost no scent and it doesn't make my head itch. Over the past few years, the price has doubled. I put up with it because I like the product. I also put up with the bad nozzles, until now. Nozzle in can completely stopped working with 2/3 a can left. I cleaned with hot water three times before giving up. Aside from a 10% refund, Amazon wouldn't help because return window had closed. Hate to say it, but I no longer recommend this product.",2022-03-16 00:21:26.703206
B07KPP2S7F,2022,3,16,1,Ongoing review (Part 3),5.0 out of 5 stars,7 people found this helpful,"Reviewed in the United States on February 15, 2021",acarter1123,,Verified Purchase,,Part 3 and last review,2022-03-16 00:21:33.885376
B07KPP2S7F,2022,3,16,2,Another snake oil #938493848924,1.0 out of 5 stars,4 people found this helpful,"Reviewed in the United States on August 10, 2021",Andrew Amazon666,,Verified Purchase,,FIRST PHOTO (February 2021),2022-03-16 00:21:33.885376
B07KPP2S7F,2022,3,16,3,Works as well if not better than a far more expensive product.,5.0 out of 5 stars,3 people found this helpful,"Reviewed in the United States on June 16, 2021",Richard,,Verified Purchase,,"I’ve used a certain very expensive ‘Labs’ product for about 2 years. While it was a good product, it didn’t live up to the hype especially for what it cost. The Purador product had been in my wish list for some time so when I finished the other product,  I ordered the Purador. It’s every bit as good and I believe better than the ‘Labs’ product. None of the shampoos will help you grow more hair but they certainly will improve your hair quality and make the most of what you have. A little goes a long way too, especially the conditioner. I wish the shampoo were available separately at half the cost of the twin pack for that reason but as it is, the twin pack is the same price as the shampoo alone.",2022-03-16 00:21:33.885376
B07KPP2S7F,2022,3,16,4,EXCELENTE PRODUCTO!!!,5.0 out of 5 stars,4 people found this helpful,"Reviewed in the United States on October 8, 2020",Lili,,Verified Purchase,,Les muestro estas fotos la primera es una semana después de usar este shampoo y acondicionador y la segunda foto fue antes de usarlo quiero decirles que es lo máximo para la caída de cabello solo lo llevo usando una semana y pude ver la diferencia cada día es mucho menos cabello el que se me cae así que se los recomiendo al 100% SI FUNCIONA Y ES LO MEJOR que he probado hasta hoy. Yo consulte a un especialista en cabello y le comenté que acaba de probar este tratamiento y el me dijo que siguiera usando así que se los recomiendo!,2022-03-16 00:21:33.885376
B07VSXNR2Z,2022,3,16,1,Less is more,5.0 out of 5 stars,155 people found this helpful,"Reviewed in the United States on January 8, 2021",Faustina,,Verified Purchase,,"I am a woman in my mid forties who stopped coloring and highlighting my hair about 3 years ago.  After coloring and highlighting my thick, beautiful hair since the age of 17, having children, becoming older, my hair was a frizzy, brittle, product-needing, thinning mess.  I had to style my hair more and more and use more and more products to help it look nice.  I then started a new job and began working for an older woman who had the most incredible head of shiny and thick salt and pepper and silver hair.  I asked her what products she used and she said none.  She told me she washed and conditioned only.  She said the secret was to not color your hair and find a shampoo that kept your scalp healthy but didn't fry your hair.  She said, take care of your scalp so it is able to grow healthy hair, and don't abuse your hair once it has grown out.  It was such simple advice.  I stopped coloring and highlighting right then and there.  I won't lie.  It was rough at first and I felt ugly. The grow out was tough.  I did end up cutting it short once it had grown out a bit to get rid of all the processed fried hair.  I am glad I stuck with it, though.  Three years into my natural hair journey, my hair is healthy and shiny and growing like a weed.  I have light brown hair with an awesome silver streak on the top of my head.  That was another discovery, I had no idea what hair color I had.  Anyways, once my hair grew out, I wanted to invest in a shampoo that would promote a healthy scalp and nourish my hair.  This shampoo does the trick.  I no longer have dandruff and my hair is light and full of body without frizz.  And, after years of blow drying and using a straightener, I now wash my hair and let it air dry.  I have shiny, beach waves with lots of volume and no frizz.  This shampoo cleans my scalp so well but does not strip my hair.  I only have to wash my hair twice per week and it always looks good.  I have noticed that since I started using this shampoo, my scalp no longer itches and there is definitely less hair in the drain.",2022-03-16 00:21:41.178332
B07VSXNR2Z,2022,3,16,2,It might just RUIN your hair!,1.0 out of 5 stars,93 people found this helpful,"Reviewed in the United States on January 10, 2021",Amazon Customer,,Verified Purchase,,"I bought this shampoo at the beginning of November. I used it every time I shampooed my hair for two months straight. Around the middle of December, I started noticing that my hair was falling out like crazy! I was losing a ton in the shower, a ton while combing, and more all throughout the day. Then I began to notice how horribly dry my hair started feeling. It’s feels like absolute straw! Worse than ever before! It didn’t dawn on me right away, but I’m wondering if it could all be from this shampoo and conditioner. Needless to say, I quit using it as soon as I realized it’s probably the culprit. I pray my hair goes back to normal once I cut it all of off and start over. 😭",2022-03-16 00:21:41.178332
B07VSXNR2Z,2022,3,16,3,"Non-Harmful, Good Smell and Worth the price",5.0 out of 5 stars,62 people found this helpful,"Reviewed in the United States on January 27, 2021",Isaura Hernandez,,Verified Purchase,,"Here’s my honest review: When I looked at the ingredients when I was about to buy the product, I thought it was good to be true, especially for the price. My entire teenage and adult life I have lost a lot of hair. It’s on my brush and it’s in my shower and it’s always a chunk full. On my first use of the shampoo and conditioner, I lost almost nothing. My hair didn’t fall out as much at first I thought it was weird. So, I checked the ingredients and it only has organic materials, as in no DMD, which is known to cause cancer and hair loss. I honestly feel that I will keep using this product and am looking forward to get some hair back and my lush curls back.",2022-03-16 00:21:41.178332
B07VSXNR2Z,2022,3,16,4,Worst product,1.0 out of 5 stars,40 people found this helpful,"Reviewed in the United States on February 11, 2021",Lydia E. Santana,,Verified Purchase,,"This is by far the worst product, after the second use my hair fell in locks. Picture to prove too. Never in my life my hair fell like this. Very disappointed and a waste of money if I had a choice of zero star I would pick it. I am returning this product for a full refund.",2022-03-16 00:21:41.178332
B07VSXNR2Z,2022,3,16,5,Excellent buy.  It works.,5.0 out of 5 stars,30 people found this helpful,"Reviewed in the United States on April 12, 2021",LALA,,Verified Purchase,,"I've been using this for a couple months now, and I'm finally seeing true difference.  I don't know what happened, but about 7 years ago I just started losing my, used to be, nice thick hair.  Since then I have tried everything from castor oil to rogain, to an expensive comb with red light/lasers, to regrow my hair. When I first started using this, I was freaking out because I LOST hair for the 1st week or 2. Don't freak out! 2 months later I can't see through my hair to my scalp anymore, and ny hairs all around health is noticeably better.",2022-03-16 00:21:41.178332
B07VSXNR2Z,2022,3,16,6,Made hair come out in handfuls!!,1.0 out of 5 stars,36 people found this helpful,"Reviewed in the United States on August 31, 2020",A. Hernandez,,Verified Purchase,,I used this shampoo and conditioner 3 times each time I noticed my hair was coming out when I brushed it.it was soft and it smelled ok but after the 3rd time using it I decided this product isn't helping me at all.I dont want to lose my hair I want to grow it!!  Will not ever use this again!!,2022-03-16 00:21:41.178332
B07VSXNR2Z,2022,3,16,7,Best Hair Product for Thin Hair!,5.0 out of 5 stars,27 people found this helpful,"Reviewed in the United States on March 8, 2021",Aggie Werner,,Verified Purchase,,"I absolutely LOVE this product. It has changed my thin brittle hair loss into thick and strong individual strands with no more split ends. My hair still falls out due to stress, but definitely not as much as before thanks to this product. I didn’t receive this product for free to leave a good review ... I bought it and have been using it for over 4 months now. I was so happy Costco started carrying this brand and bigger for the same amount of money ... but be aware that the Costco one doesn’t contain Keratin like this one does. So once I’m done with the Costco version I’ll order this one again on Amazon. Thank you fir saving my hair :)",2022-03-16 00:21:41.178332
B099NZT23T,2022,3,16,1,Wow!!! Amazing Results…,5.0 out of 5 stars,5 people found this helpful,"Reviewed in the United States on August 19, 2021",ozzyy,,Verified Purchase,,Wow!!! Amazing Results,2022-03-16 00:21:48.148115
B099NZT23T,2022,3,16,2,Excellent  Product,5.0 out of 5 stars,,"Reviewed in the United States on November 23, 2021",Amazon Customer,,Verified Purchase,,Got to find out where to order the bar of soap they sent with the shampoo! Both products were the best and will be buying more in the future.  Please do tell where we can get the soap,2022-03-16 00:21:48.148115
B099NZT23T,2022,3,16,3,Pump broken,2.0 out of 5 stars,,"Reviewed in the United States on September 1, 2021",Tatiana,,Verified Purchase,,"Bottle pump was damaged. Having to open the top and use it with out a pump is inconvenient when you have kids who use the same shampoo….conditioner bottle was just as bad, small amount would come out.",2022-03-16 00:21:48.148115
B099NZT23T,2022,3,16,4,Superior customer service!,5.0 out of 5 stars,,"Reviewed in the United States on October 30, 2021",anitalh,,Verified Purchase,,This company has superior customer service.  One of the bottles was broken in shipping and they replaced the entire order!  Even the special gifts.  I would definitely reorder this product.  Product works perfectly and smells so refreshing.,2022-03-16 00:21:48.148115
B099NZT23T,2022,3,16,5,Love this stuff will be reordering,5.0 out of 5 stars,,"Reviewed in the United States on January 29, 2022",Kindle Customer,,Verified Purchase,,It's perfect,2022-03-16 00:21:48.148115
B099NZT23T,2022,3,16,6,Horrible. DONT BUY,1.0 out of 5 stars,One person found this helpful,"Reviewed in the United States on September 26, 2021",Taylor,,Verified Purchase,,This shampoo and conditioner is,2022-03-16 00:21:48.148115
B099NZT23T,2022,3,16,7,"Like the product, bottle is crunchy",4.0 out of 5 stars,,"Reviewed in the United States on January 30, 2022",Taylor Vadden,,Verified Purchase,,I like the product but the bottle doesn't seem to stay it's uniform shape. It seems to collapse on the side and kinda crunches up/wrinkles.,2022-03-16 00:21:48.148115
B099NZT23T,2022,3,16,8,Si es bueno lo recomiendo.,4.0 out of 5 stars,,"Reviewed in the United States on September 23, 2021",Lolaahmartinez,,Verified Purchase,,Está muy bien la hidratación y muy suave y huele muy bien.,2022-03-16 00:21:48.148115
B008OL3WZC,2022,3,16,1,Please listen to reviews!,1.0 out of 5 stars,141 people found this helpful,"Reviewed in the United States on March 29, 2019",Jaclyn,,Verified Purchase,,"I do not recommend this product. I did a lot of research on organic and natural shampoos and this one went on sale so I decided to try it even though I knew there were mixed reviews. Some people have used this product for a long time but recently said its not the same and has been watered down. I think that is the case because my shampoo had a very watery consistency. My main complaint is that I could not get it through my hair. I have fine hair, but A LOT of it. I even sectioned my hair off into three parts to be able to get to the roots better. After a few uses my hair was an oily nasty mess. After I washed my hair it would dry and look super greasy even on the ends! Overall, if you are looking for a more natural shampoo, please look elsewhere and save some money and time! Also, it is good to note this is a non-returnable purchase.",2022-03-16 00:21:55.160424
B008OL3WZC,2022,3,16,2,Going in the garbage!,1.0 out of 5 stars,51 people found this helpful,"Reviewed in the United States on August 22, 2019",RJ Fisher,,Verified Purchase,,"If you’d like your hair to feel like dry grass clippings, this is the shampoo for you.",2022-03-16 00:21:55.160424
B008OL3WZC,2022,3,16,3,Leave well enough alone!,1.0 out of 5 stars,26 people found this helpful,"Reviewed in the United States on December 8, 2020",AmazonCustomer,,Verified Purchase,,"I have no idea why companies feel the need to ""improve"" on products that were already working well. I first became acquainted with this brand when I purchased the Scalp Treatment Tea Tree Shampoo in 11 oz. I enjoyed it so much that I decided to purchase it in a larger 32 oz. size - HUGE mistake. The 11 oz. boldly states that the shampoo is SULFATE FREE, but for whatever ""reason"" the 32 oz. is NOT - it contains sodium coco-sulfate. I soon realized that this would be an issue upon grabbing my unopened bottle and seeing the words -now- RICHER LATHER plastered on the front.",2022-03-16 00:21:55.160424
B008OL3WZC,2022,3,16,4,Honest review,3.0 out of 5 stars,8 people found this helpful,"Reviewed in the United States on May 10, 2020",Kshama,,Verified Purchase,,"I've been using this shampoo for about 2-3 years now but I've only purchased it from our local Sprouts (grocery store). I usually buy it only when it's on sale ($15.99). Seeing how it was so much cheaper on amazon, I decided to try it!",2022-03-16 00:21:55.160424
B008OL3WZC,2022,3,16,5,Not the same as the previous bottle purchased!,2.0 out of 5 stars,14 people found this helpful,"Reviewed in the United States on March 12, 2019",Phil_in_CA,,Verified Purchase,,"First, let me share that I was very glad it arrived in a sealed bag, because the top had spun loose and it would have been a SUPER MESS if it hadn’t! Secondly, this is the second bottle of this shampoo that I have gotten, and this latest shampoo is runny and not as concentrated as the previous bottle! The first bottle had thick, concentrated shampoo in it, that took only one pump to make thick lather... THIS second bottle has thin, watery shampoo in it! I have to use 3 pumps to get some lather on my hair! Bummer! I’m not sure that I will buy this product again... I do love the fragrance and it does clean my hair, BUT it takes so much shampoo from the bottle, that I feel as if I have been cheated... like they put water in it, or something!",2022-03-16 00:21:55.160424
B008OL3WZC,2022,3,16,6,Calms my scalp and keeps my hair healthy,4.0 out of 5 stars,10 people found this helpful,"Reviewed in the United States on April 7, 2020",masreth,,Verified Purchase,,"At first I bought the smaller bottle to test it out... it's watery, but after a while I realized it's been helping my scalp so much! It does not contain sulfate and I like that it's so clearly labeled bec I found out I'm allergic too sulfate a while back!  My scalp is calmer, I also feel like my hair does not get as oily anymore. I used to have to wash it every day, but now I can go a few days without! For the price, it's much better product then the paul Mitchell one. I've tried the paul Mitchell one before and it has a very strong smell, this product does not, which is another thing I like about it.",2022-03-16 00:21:55.160424
B0038TXGL0,2022,3,16,1,Not genuine,1.0 out of 5 stars,152 people found this helpful,"Reviewed in the United States on August 24, 2019",Hannah Sue Bowden,,Verified Purchase,,"I knew the price was just too good... The bottle arrived covered in sticky goop, with about an ounce of the ""shampoo"" gone. Immediately, I noticed the color was completely wrong; it's practically white and the genuine coconut & hibiscus shampoo is MUCH darker. It smells like chemicals instead of the lovely coconutty scent. Lastly, the consistency is too thin for it to be the real deal. I'm so thankful Amazon issued a full refund.",2022-03-16 00:22:01.903262
B0038TXGL0,2022,3,16,2,Not properly sealed. Possibly tampered bottles,1.0 out of 5 stars,99 people found this helpful,"Reviewed in the United States on August 21, 2019",Breeze,,Verified Purchase,,"When I received the one bottle I purchased, it had leaked all over everything inside the box. The cap was loose and the ""seal"" was in the cap... not sure if it was properly sealed or tampered with. It also has a strange smell, however I've never used this product before so I dont know how its supposed to smell. Definitely no hibiscus or coconut, just a sour detergent like smell.",2022-03-16 00:22:01.903262
