B078H4HXSM,2022,3,16,8,"Smells heavenly, but will destroy your hair long term",2.0 out of 5 stars,18 people found this helpful,"Reviewed in the United States on March 13, 2020",K.G,,Verified Purchase,,"This product is deceptive, because it smells divine, gives you soft, bouncy, shiny hair with just a drop or two of product. I thought it was great, kept repurchasing and used it alongside the television perfect conditioner every other day (oily hair) for an entire year. However, all the while i was using the shampoo it was actually stripping the bonds in my hair leading to breakage, and brittle hair while the conditioner did nothing to protect it. I'm so sad and sorry that it took me such a long time to make the connection. I have stopped using it, and found a drugstore shampoo and conditioner to help repair my hair. I really miss the smell tho.",2022-03-16 01:41:51.513769
B0846GJTWF,2022,3,16,1,OK.  I'm impressed.,5.0 out of 5 stars,82 people found this helpful,"Reviewed in the United States on June 7, 2020",Daniel,,Verified Purchase,,"I have bad dandruff.  I've been using head and shoulders for years.  Its so bad, I use a nail brush to scrub my scalp in the shower, and occasionally a compressed air gun to blow skin flakes out of my hair.  I know that's gross... sorry.  It does create an impressive cloud of dandruff in the air.  My forehead itches and flakes too.  I have to put hydrocortisone cream on it every couple of days.",2022-03-16 01:42:22.026557
B0846GJTWF,2022,3,16,2,Pay attention to bottle sizes,4.0 out of 5 stars,56 people found this helpful,"Reviewed in the United States on March 27, 2020",Bookbinder,,Verified Purchase,,"Watch the bottle size. This shipment contained one seven ounce and one 4 ounce bottle, not two full size 7 ounce bottle. It’s cheaper per ounce to get the larger sizes. The description does say what’s included but it’s easy to miss the difference when price shopping. The shampoo itself is very effective",2022-03-16 01:42:22.026557
B0846GJTWF,2022,3,16,3,Works great!!!!,5.0 out of 5 stars,36 people found this helpful,"Reviewed in the United States on August 26, 2020",Amazon Customer,,Verified Purchase,,"My daughter is African American and her scalp was really the worst I have ever seen it. Thanks to awesome reviews from others, I decided to try this before we approached our doctor again.  Thankfully this worked.  In less than a month, her scalp was free of severe flaking. It was really bad and this cleared it up. I was worried and frustrated so thank you for this solution to our problem!",2022-03-16 01:42:22.026557
B0846GJTWF,2022,3,16,4,It’s 2:00am where I am and I just have to share how awesome this stuff is,5.0 out of 5 stars,29 people found this helpful,"Reviewed in the United States on December 9, 2020",Amazon Customer,,Verified Purchase,,"So it’s winter and that means there’s no moisture in the air and my scalp will be dry AF, anyway all had been good until like 1 hour ago when my head just inched lightly and then scratch after scratch it got worse and burned worse until finally I got up to use my usual quick fix (watered down peppermint oil) and it didn’t do a damn thing. So I decided to bite the bullet and wash my hair (because mind you my head if ON FIRE). I used this as shampoo and washed only with ice water, I did a deep scrub and lather for a few minutes and then rinsed and did the conditioner. THE ITCHING IS GONE! in its place is this cooling, tingling sensation almost like I put an ice pack on my head, and I knew I couldn’t just go to sleep and let some poor soul with an itchy head not know what to do about it so PEOPLE, please, buy a couple bottles. It’ll save you at some point, I promise.",2022-03-16 01:42:22.026557
B0846GJTWF,2022,3,16,5,WORKS quickly,5.0 out of 5 stars,16 people found this helpful,"Reviewed in the United States on November 17, 2020",Patty Rodriguez,,Verified Purchase,,"I wish I had known about this shampoo earlier.  I had some seriously dry scalp that I struggled with.  I had been using head and shoulders for years but nothing seemed to work for my dandruff so I wasn't sure if it was dry scalp or dandruff.  I tried multiple shampoo and oils and nothing.  I was on the verge of going to the dermatologist but I decided to purchase this product and give it our last try and let me just say, I used it a couple times a week and not even a week and a half later, it's like seriously cured my dandruff.",2022-03-16 01:42:22.026557
B0846GJTWF,2022,3,16,6,WORKS GREAT...SHINNY HAIR,5.0 out of 5 stars,21 people found this helpful,"Reviewed in the United States on March 23, 2020",Joanne Heller,,Verified Purchase,,I bought this product because I had an itchy scalp. I used the product several years ago when my dermatologist,2022-03-16 01:42:22.026557
B0846GJTWF,2022,3,16,7,THE BEST dandruff shampoo in the world...healed my husband's scalp like magic,5.0 out of 5 stars,13 people found this helpful,"Reviewed in the United States on December 13, 2020",Antonella Fernandez,,Verified Purchase,,"Bought this for my hubby who has suffered since I met him with dandruff and always claimed nothing worked on him and I have tried it all trust me, from home remedies to masks, to a million shampoos. Until one day a blogger recommend this on her Instagram and I gave it a try. My husband said this has literally cured his dandruff and he is right. I cut his hair and I use to see how horrible his dandruff would scab and bleed, but ever since he used this, he has never had a single scab again. His scalp literally healed with this product and I'm so grateful to have finally found what he needed . this is a must buy if you have bad dandruff issues",2022-03-16 01:42:22.026557
B0846GJTWF,2022,3,16,8,Best Dandruff Shampoo,5.0 out of 5 stars,16 people found this helpful,"Reviewed in the United States on May 17, 2020",Lauren,,Verified Purchase,,"It does the job better than shampoos with different active ingredients. My scalp didn’t like Head and Shoulders or Selsun Blue. After using this twice, my scalp cleared up. It also shipped on time and was not crushed in box. Would buy again. One thing real quick, you may need to apply conditioner to your hair as this will dry it out like most dandruff shampoos. Not an extreme amount though. I have never dyed, very thick and wavy hair.",2022-03-16 01:42:22.026557
B097255ZJB,2022,3,16,1,Works great for my newly permed hair!,5.0 out of 5 stars,,"Reviewed in the United States on October 14, 2021",Hailey Kisseberth,,Verified Purchase,,"Only thing I dont like about the shampoo is that it has silicones in it. But other than that, I love it it makes my newly permed hair bouncy and quenched! Smells amazing and you cannot beat the price. Just wish the shampoo was silicone/sulfate free 😊",2022-03-16 01:42:28.596314
B097255ZJB,2022,3,16,2,Yummy scent,5.0 out of 5 stars,,"Reviewed in the United States on October 28, 2021",Emily W.,,Verified Purchase,,Scent is absolutely amazing without being too overpowering. Leaves my air feeling clean and soft. Definitely makes my curls bouncier and more defined without being oily or leaving a product feel. Love this stuff will be repurchasing.,2022-03-16 01:42:28.596314
B097255ZJB,2022,3,16,3,Receive many compliments on smell,5.0 out of 5 stars,,"Reviewed in the United States on February 17, 2022",Kelley D.,,Verified Purchase,,Doesn’t irritate my sensitive scalp.,2022-03-16 01:42:28.596314
B097255ZJB,2022,3,16,4,DONT BUY,1.0 out of 5 stars,,"Reviewed in the United States on September 29, 2021",Kelly,,Verified Purchase,,I have read the reviews before but did not believe them since it was recommended by ALLURE.,2022-03-16 01:42:28.596314
B097255ZJB,2022,3,16,5,Amazing for my natural curls!,5.0 out of 5 stars,,"Reviewed in the United States on August 24, 2021",Laura Richter,,,,"Wow do I I love this product! I have long , thick, naturally wavy/curly hair. After a recent trim to get rid of the dead stuff and split ends, this works even better! My hair loves it, my curls look prettier than they have in years. So glad I found this. Just a note , If you don’t have natural curls, a shampoo isn’t going to give you them.",2022-03-16 01:42:28.596314
B09252NQJ9,2022,3,16,1,Awful!,1.0 out of 5 stars,16 people found this helpful,"Reviewed in the United States on June 19, 2020",Milana ,,Verified Purchase,,"There is nothing similar with the product I bought in target. It’s not a shampoo and not a conditioner, I ordered two bottles and it’s a fake! Don’t waste your money as I did. “The shampoo” has totally different consistency, it feels like water , not even a soap!",2022-03-16 01:42:56.474972
B09252NQJ9,2022,3,16,2,Be careful! COUNTERFEIT!,1.0 out of 5 stars,12 people found this helpful,"Reviewed in the United States on June 20, 2020",Melanie Fontana,,Verified Purchase,,I received a counterfeit bottle that smelled like glue and bleach. BEWARE!,2022-03-16 01:42:56.474972
B09252NQJ9,2022,3,16,3,LOVE IT and it makes a difference....continued use equals love,4.0 out of 5 stars,5 people found this helpful,"Reviewed in the United States on February 3, 2021",Dana Dupont,,Verified Purchase,,"I love this shampoo. My hair lacks moisture and was getting really just dry and the ends were starting to split. I have worked really hard and LONG for naturally long hair. I do not want my ends to break off. This zip up technology they got going is hreat . it doesn't work overnight obviously..nothing does but it is working . I'm seeing less splits. Although after the first use it was o soft on the shower it felt really silky and th e next day I had to iron my hair. Well not iron I never use heating tops anymore but when I do I use this heating brush. It uses less heat and your done quickly, each strands needs one brush. Anyway after I was done like hours later I ran my hands through my hair and thought omg is th is because of that shampoo? It was suddenly feeling ""thicker"" and so soft kinda as if there was no brittle strands or dead ends so on and so forth. I'm kinda stumped on describing it. It reminded me of holding brand new human hair extensions. Just so perfect and new. So it is amazing. I've seen a huge difference. Worth ever scent and smells great! It is a thick shampoo so little goes a looking way. So I don't even mind that it is a somewhat small bottle.",2022-03-16 01:42:56.474972
B09252NQJ9,2022,3,16,4,NOT the same product you get in store,1.0 out of 5 stars,12 people found this helpful,"Reviewed in the United States on June 8, 2020",Jbird,,Verified Purchase,,"I'm not sure what the difference in sourcing is, but this is NOT the same product I have purchased in-store.",2022-03-16 01:42:56.474972
B09252NQJ9,2022,3,16,5,A self care must have!  You hair will thank you!,5.0 out of 5 stars,One person found this helpful,"Reviewed in the United States on February 5, 2022",Mommies2cuties,,Verified Purchase,,"Seller rate: 5 stars Correct items received, packaged well to prevent accidental opening of items during shipping.  Received item with in stated time frame.  Highly recommended this seller and will buy from this seller again.",2022-03-16 01:42:56.474972
B09252NQJ9,2022,3,16,6,Great Clarifying Shampoo,4.0 out of 5 stars,One person found this helpful,"Reviewed in the United States on December 15, 2021",Ms. Zombi_Killa,,Verified Purchase,,"Bought this after reading about how amazing the scent was and its gentle clarifying properties. I have hair past my waist and as expected my roots tend to need washing well before the rest of my hair and due to weight, dry shampoo doesnt always help. So, this shampoos scent is amazing, it does clarify maybe a little too well as my hair tends to tangle easily if I don't use a conditioner on the ends after using it (I don't use a conditioner every time due to oiliness). So overall a great shampoo. Bottle was a little smaller than I expected.",2022-03-16 01:42:56.474972
B09252NQJ9,2022,3,16,7,terrible,1.0 out of 5 stars,6 people found this helpful,"Reviewed in the United States on June 24, 2020",Bruce T.,,Verified Purchase,,this is not the same shampoo as bought at Target.,2022-03-16 01:42:56.474972
B09252NQJ9,2022,3,16,8,What's Not to Like.,5.0 out of 5 stars,,"Reviewed in the United States on October 6, 2021",Last Picasso,,Verified Purchase,,"I am a guy who has thinning and slightly oily hair. I tried this shampoo several months ago and liked it because it cleans oily hair well, it has a creamy lather, and it smells good. Nice way to start off the day, right?",2022-03-16 01:42:56.474972
B089ZSMD39,2022,3,16,1,Unnecessary Reformulation,2.0 out of 5 stars,34 people found this helpful,"Reviewed in the United States on June 17, 2020",JUST WHAT I NEEDED,,Verified Purchase,,Regarding Fekkai Full Blown Volume Shampoo: This reformulation of my all-time-favorite shampoo is a huge disappointment.  Here goes another expensive search for the perfect shampoo...,2022-03-16 01:43:57.723841
B089ZSMD39,2022,3,16,2,Disappointed...,1.0 out of 5 stars,25 people found this helpful,"Reviewed in the United States on October 2, 2020",paul martinson,,Verified Purchase,,This is my wife's favorite shampoo. I ordered it for her and she was very disappointed. This is her comment. They have reformulated my favorite shampoo and not in a good way. The original gave my fine hair great volume and allowed me to wash my hair every other day. The new version does not produce the volume and my hair is greasy the next day.  I will have to start looking around for a replacement. Sigh... Why did they go and spoil a good thing???,2022-03-16 01:43:57.723841
B089ZSMD39,2022,3,16,3,Disappointing. Smells Like Oranges Brined in Pinesol.,2.0 out of 5 stars,18 people found this helpful,"Reviewed in the United States on March 17, 2020",Michelle N.,,Verified Purchase,,"Several months ago, I discovered Fekkai's Full Blown Volume Shampoo (Citrus Extract & Ginseng) and fell in love. It made my hair feel ridiculously soft and smooth, and I couldn't stop myself from smelling and touching my hair every ten minutes.",2022-03-16 01:43:57.723841
B089ZSMD39,2022,3,16,4,This actually seems to add volume,5.0 out of 5 stars,7 people found this helpful,"Reviewed in the United States on November 13, 2020",LindaW,,Verified Purchase,,"I was skeptical but I thought worst comes to worst, it's a shampoo that will at least clean my hair.  However, it actually seems to add volume.  I didn't expect nor did I get miracles but I do notice a volumizing effect.  I did not get the conditioner but I just ordered it.  It is pricey but you don't need much for a good cleanse.  It has a pleasant scent that is subtle.  I typicall wash and use either a spray on or a regular conditioner, then a soft volumizing mousse, and let air dry while scrunching periodically.  When It dries and I brush out, my hair looks fuller.  I will see if the conditioner adds to the effect but either way, not a waste of money.",2022-03-16 01:43:57.723841
B089ZSMD39,2022,3,16,5,Formula changed and it's horrible! Not the same product I've been using for years.,1.0 out of 5 stars,13 people found this helpful,"Reviewed in the United States on February 14, 2021",Tiburon Blond,,Verified Purchase,,I've been using FEKKAI Full Blown Volume Shampoo for years and loved it. But I noticed with my most recent order of this product the formula changed and it's horrible. The shampoo is now very watery and you need to use twice as much to get a halfway decent lather. It always had a very mild scent but now the fragrance is overpowering and nauseating. They even changed the packaging. Now it's opaque and you can't see how much product you have left. DO NOT BUY THIS PRODUCT!!!,2022-03-16 01:43:57.723841
B089ZSMD39,2022,3,16,6,If your thin hair needs help - try this shampoo!,5.0 out of 5 stars,9 people found this helpful,"Reviewed in the United States on January 24, 2020",ellesu,,Verified Purchase,,"I am always on the lookout for a shampoo that will help my thin, fine hair look a bit fuller. After using Fekkai FBV shampoo the first time I had hopes that I had found a product I could count on - and it hasn't failed me. My hair always looks fuller after washing and never feels greasy or weighed down. I order with subscribe and save and even then always like to have a spare bottle around.",2022-03-16 01:43:57.723841
B089ZSMD39,2022,3,16,7,New Formula: Not a fan!,2.0 out of 5 stars,6 people found this helpful,"Reviewed in the United States on June 7, 2020",BanjoPearl,,Verified Purchase,,"I've been shampooing with Fekkai Full Blown Volume for several years and have loved everything about it: fragrance, creamy texture, lathering volume, and of course the fullness it's given my hair. Today, I tried the new formula. It's scent, described as French Oak, was immediately disappointing. Too woody and masculine for my taste. The shampoo was also thinner and did not lather as well.  The volumizing effect on my hair was similar, but I hope the original formula and fragrance will return. I don't like this one enough to purchase it again.",2022-03-16 01:43:57.723841
B089ZSMD39,2022,3,16,8,for all you environmentalists with thin hair this is for you!,5.0 out of 5 stars,8 people found this helpful,"Reviewed in the United States on February 16, 2020",Amazon Customer,,Verified Purchase,,I’m going to start by saying I don’t normally feel strongly enough to write reviews: but this product wowed me!,2022-03-16 01:43:57.723841
B076Q7L95C,2022,3,16,1,NOT GOOD FOR COLOR-TREATED HAIR!!!,1.0 out of 5 stars,112 people found this helpful,"Reviewed in the United States on March 6, 2018",Jordana,,Verified Purchase,,"I wanted to like this. I have never written a bad review if it can be avoided, but I don't want someone else to buy this and have the same issues I had.",2022-03-16 01:44:08.792144
B076Q7L95C,2022,3,16,2,I used to love this - what happened??,1.0 out of 5 stars,82 people found this helpful,"Reviewed in the United States on January 1, 2018",Gibby,,Verified Purchase,,"I used to love this shampoo and ordered 3 at a time to be sure I didn't run out - They changed it!! It no longer does for my hair what it used to - it is not the same. Now when you put it in your hand it is all watery. My hair used to look and feel great, but now it cleans, but my hair does not get the soft amazing feel it used to. Make sure you look at newer reviews. They hooked me and then changed it, watered it down. I will no longer be ordering it and now am on the search for another shampoo.",2022-03-16 01:44:08.792144
B076Q7L95C,2022,3,16,3,Lots of Itching,2.0 out of 5 stars,25 people found this helpful,"Reviewed in the United States on March 23, 2019",AlMathews,,Verified Purchase,,"I've been looking for a new, sulfate-free shampoo and was excited to try this one. The reviews were good. I have thin, oily hair, and the first day or two I used it, I was impressed by how my hair looked less oily and seemed healthier. But there was a vague itch in the back of my scalp I ignored. After several days of use, my scalp was itching SO bad that I realized it had to be the shampoo, and I was having some kind of allergic reaction to it. Plus, my hair was not only feeling less oily, it was starting to look dry and frail, which is almost worse. I stopped using the shampoo, but even now--a month later--my scalp is still dry and extremely itchy. I have no idea how to treat it, and I'm back to finding a new shampoo. I'm sure not everyone will have these results, but if you notice any itching, I'd stop using it immediately. It's been miserable.",2022-03-16 01:44:08.792144
B076Q7L95C,2022,3,16,4,GET READY FOR JUNK MAIL TO YOUR MAILBOX!,2.0 out of 5 stars,20 people found this helpful,"Reviewed in the United States on September 10, 2018",T. F.,,Verified Purchase,,"We love this shampoo, because it definitely makes our hair softer.",2022-03-16 01:44:08.792144
B076Q7L95C,2022,3,16,5,Waste of money,1.0 out of 5 stars,71 people found this helpful,"Reviewed in the United States on March 3, 2017",M.Eli,,Verified Purchase,,I've used this shampoo three times and it leaves my hair so dry. I've also noticed that my scalp is a lot more itchy and flaky. I'm really disappointed that it didn't work for me because everyone on here gave it such rave reviews. I had to stop using it. Waste of money.,2022-03-16 01:44:08.792144
B076Q7L95C,2022,3,16,6,Dont recommend it.,1.0 out of 5 stars,18 people found this helpful,"Reviewed in the United States on June 14, 2018",Volkan V,,Verified Purchase,,I dont know why this shampoo gets all this 5 star reviews because there is nothing 5 star about it. Its been a month i bought it i tried 1st day but didnt like it much i tried 2 more times later and nope its not good. It doesnt make you feel like that fresh feeling after a shower.,2022-03-16 01:44:08.792144
B076Q7L95C,2022,3,16,7,It's nothing spacial and it's overpriced! But they have great custom service!,3.0 out of 5 stars,44 people found this helpful,"Reviewed in the United States on June 16, 2017",S.L.,,Verified Purchase,,"this shampoo is really nothing special about, it's obviously overpriced. it is very small bottle for the price.  I can't see any difference it made my hair turn out. I have little nature curly hair, and after using this shampoo, just like every other one, my hair is still looks fuzzy the next day.  I honestly don't feel this product is much better than the one you can buy it from drug store for only $ 4-5, and you get a huge bottle of shampoo, and the result of your hair is just as same as this bottle.",2022-03-16 01:44:08.792144
B076Q7L95C,2022,3,16,8,Excellent on both beard and scalp hair!,5.0 out of 5 stars,3 people found this helpful,"Reviewed in the United States on January 7, 2020",WheelerCub,,Verified Purchase,,"I started touching up my beard with Just for Men a couple years ago and was looking for a shampoo that would protect the color, while also keeping my beard clean and soft. I found Pure Argan Oil Shampoo through an online video recommendation as well as a few online publications for color treated hair and beards, and have been using it since. My beard looks fantastic, smells great, is soft to the touch, and it protects my beard hair follicles. Additionally, because the shampoo leaves my skin soft and moisturized, I wind up needing to use less beard oil. So the color lasts even longer than I expected, allowing me to go around 2 weeks between touch-ups. Of course, it works great on my scalp hair as well, so it's a one-stop-shop, and a double win for me. In all honesty, it's been my Pure Argan was everything I hope and more. So I'll probably be using it for many years to come.",2022-03-16 01:44:08.792144
B09PJ5B543,2022,3,16,1,ISSA LIE,1.0 out of 5 stars,361 people found this helpful,"Reviewed in the United States on April 17, 2019",Alex S.,,Verified Purchase,,"I HIGHLY doubt this is an authentic product, or maybe at some point in time someone switched the actual product with this minty water in a bottle, because that's what this is: water that smells faintly of mint. I was surprised when there was no seal on the bottle, and the liquid at the top was super bubbly which, hello, oil is thicker and less prone to bubbles because its density makes it harder for air to move through it and get trapped.",2022-03-16 01:44:20.228207
B09PJ5B543,2022,3,16,2,This is tap water in a bottle save your money and buy else where,1.0 out of 5 stars,288 people found this helpful,"Reviewed in the United States on February 20, 2019",AG,,Verified Purchase,,I literally was send water in a bottle. It had no seal  and a very fainted smell of mint...no thickness to it at all. I always buy OXG products which had a wonderful smell; this one is a knock off. If you want to try it purchase in store.,2022-03-16 01:44:20.228207
B09PJ5B543,2022,3,16,3,IT WORKS!!!!!!  LOVE THE SCENT!!!,5.0 out of 5 stars,178 people found this helpful,"Reviewed in the United States on July 5, 2020",McSusie,"
        TOP 100 REVIEWER",Verified Purchase,,UPDATE:,2022-03-16 01:44:20.228207
B09PJ5B543,2022,3,16,4,My daughter had Never-ending dry scalp,5.0 out of 5 stars,232 people found this helpful,"Reviewed in the United States on March 27, 2019",Valerie,,Verified Purchase,,My daughter had a section of her scalp that was so dry every time I brushed it I actually thought I was seeing lice nits. Upon closer inspection I realized they weren’t nits but dead skin flakes. I tried everything even Head & Shoulders clinical to no avail the damn flakes wouldn’t go away. I went against the directions on this bottle though. Tea tree oil does not smell good and I wasn’t about to let oil sit on my child head all day. 30 minutes before a shower I would literally baste that part of her head in this oil and then she would shampoo and rinse it out. After 2-3 consistent uses it went away and never came back and her hair is flake free now! I know she is prone to dry scalp so to maintain moisture I plan to use this on her only once a week...it really works!,2022-03-16 01:44:20.228207
B09PJ5B543,2022,3,16,5,Minimal oily-look and still very effective!,5.0 out of 5 stars,263 people found this helpful,"Reviewed in the United States on December 6, 2018",Amazon Customer,,Verified Purchase,,"I purchased this after being diagnosed with dermatitis on my scalp. I've been using prescription shampoo for the dermatitis, however, it dries out my scalp terribly. I put just a little of this on the dry areas and it works wonderfully. Unlike other, much more expensive products I've ordered, the oily-residue is minimal so I can put this in multiple times a day (while at work, running errands, etc) and it doesn't look like my hair is wet or dirty. This was a great and very affordable find!",2022-03-16 01:44:20.228207
