B07G3S6YYG,2022,3,16,1,Good,3.0 out of 5 stars,One person found this helpful,"Reviewed in the United States on March 25, 2021",G. Kellz,,Verified Purchase,,"Love the soap, hate the pump. Just use a flip cap. It would be a better experience.",2022-03-16 02:50:24.599612
B07G3S6YYG,2022,3,16,2,"Rich lather, mild on skin",5.0 out of 5 stars,,"Reviewed in the United States on October 2, 2021",Nicky Nick,,Verified Purchase,,First time trying a black soap body wash but I'm immediately satisfied. Will keep replenishing as part of my shower time ritual. I haven't found this to be drying as soaps are.,2022-03-16 02:50:24.599612
B07G3S6YYG,2022,3,16,3,Better Quality Product On Shea Radiance Website,1.0 out of 5 stars,One person found this helpful,"Reviewed in the United States on February 23, 2021",Tal,,Verified Purchase,,I like ordering from the website better. The products on here seem older. My pump never works when I order off Amazon. Even the labels are different on here. The only plus is that it ships faster from here.,2022-03-16 02:50:24.599612
B07G3S6YYG,2022,3,16,4,Great Shower Product,5.0 out of 5 stars,,"Reviewed in the United States on August 7, 2021",Sue,,Verified Purchase,,Use this Shea butter product for showers.  It is a perfect product for very dry skin in the summer or winter.  Enjoy!!!,2022-03-16 02:50:24.599612
B07G3S6YYG,2022,3,16,5,Soothing,4.0 out of 5 stars,,"Reviewed in the United States on January 19, 2022",Trish239,,Verified Purchase,,"This body wash feels luxurious, and has a pleasant scent.",2022-03-16 02:50:24.599612
B07G3S6YYG,2022,3,16,6,The product arrived wi4h box leaking and spillage in bottom of box,4.0 out of 5 stars,,"Reviewed in the United States on August 19, 2021",Merilegs,,Verified Purchase,,Messy presentation. Leakage inside box!Haven't even used the product but won't buy anymore from this place.,2022-03-16 02:50:24.599612
B07G3S6YYG,2022,3,16,7,new containers a drop off,3.0 out of 5 stars,One person found this helpful,"Reviewed in the United States on April 20, 2021",Kevin Ahern,,Verified Purchase,,New containers do not dispense the liquid soap as well as the former containers did,2022-03-16 02:50:24.599612
B07G3S6YYG,2022,3,16,8,The best liquid black soap,5.0 out of 5 stars,,"Reviewed in the United States on April 25, 2021",Lynette,,Verified Purchase,,I have been using this product for a while and it is great for my skin and I love the scent and how it lathers up. And I like the fact that it is a black woman owned company that gets its shea butter directly from Africa.,2022-03-16 02:50:24.599612
