B01ITVHMRA,2022,3,16,6,No,1.0 out of 5 stars,,"Reviewed in the United States on January 6, 2021",Luisa R.,,Verified Purchase,,Left my hair very dry and like a broom. My curls wer completely gone. I wouldn’t recommend. If you want a good brand try Redken. If you are vegan and want a zero cruelty try Shea Moisture,2022-03-16 01:37:56.716299
B01ITVHMRA,2022,3,16,7,Mixed...,3.0 out of 5 stars,,"Reviewed in the United States on December 9, 2020",Gypsy Willams,,Verified Purchase,,"Cons: Does not keep my mixed race (half black, half white) curly hair under control. Pros: it works great for my sons wavy thick hair. He seems to have great hair day's with this product",2022-03-16 01:37:56.716299
B01ITVHMRA,2022,3,16,8,Makes curly hair beautiful and the shine is fantastic,5.0 out of 5 stars,,"Reviewed in the United States on July 21, 2021",Pamela,,Verified Purchase,,Fantastic shampoo that works wonders for my husband’s curly hair. After uses it the girls are beautiful and the shine is fantastic,2022-03-16 01:37:56.716299
B08G5L31DN,2022,3,16,1,Not my choice,3.0 out of 5 stars,2 people found this helpful,"Reviewed in the United States on March 1, 2021",Keysie Llorens,,Verified Purchase,,"Putting 3 stars only because it did not work for me, however it used to work for my husband.",2022-03-16 01:38:15.827826
B08G5L31DN,2022,3,16,2,Helps with hair loss,5.0 out of 5 stars,One person found this helpful,"Reviewed in the United States on August 15, 2021",Amazon Customer,,Verified Purchase,,My husband started loosing patches of hair after using this shampoo for a month his hair is much thicker and stronger.,2022-03-16 01:38:15.827826
B08G5L31DN,2022,3,16,3,Absolute NO!!,2.0 out of 5 stars,,"Reviewed in the United States on January 15, 2022",Frank,,Verified Purchase,,"This shampoo makes my hair sticky. I had to shampoo it like 3x bc it left my hair hard and stiff, in a severe need of conditioner. So as usual, I then conditioned my hair but even thereafter, my hair was not smooth or easy to comb. So, it’s a definite no!",2022-03-16 01:38:15.827826
B08G5L31DN,2022,3,16,4,100% excelente,5.0 out of 5 stars,,"Reviewed in the United States on January 22, 2022",Veronica Guevara,,Verified Purchase,,Estoy encantada con este Shampoo . Se me caía mucho mi cabello y desde que lo uso . Eso cambio y ahorita hasta me esta creciendo 🥰 estoy que lo dejo de usar .,2022-03-16 01:38:15.827826
B08G5L31DN,2022,3,16,5,Great price,5.0 out of 5 stars,,"Reviewed in the United States on August 3, 2021",Alan ,,Verified Purchase,,Fast shipping great product at great price.,2022-03-16 01:38:15.827826
B08G5L31DN,2022,3,16,6,Shipped with loose lid,4.0 out of 5 stars,One person found this helpful,"Reviewed in the United States on May 8, 2021",Amazon Customer,,Verified Purchase,,"Product was shipped with the lid left slightly unscrewed. There was some leaking in the box by the time it got to me. Not a huge amount, but not how things should have gone regardless.",2022-03-16 01:38:15.827826
B08G5L31DN,2022,3,16,7,Great volume and does not affect color of hair.,5.0 out of 5 stars,,"Reviewed in the United States on February 13, 2022",Linda Kowalski,,Verified Purchase,,"Great product, hard to find and works well.",2022-03-16 01:38:15.827826
B08G5L31DN,2022,3,16,8,Package better,3.0 out of 5 stars,,"Reviewed in the United States on June 24, 2021",Raquel Hernandez,,Verified Purchase,,I love this shampoo but they should of packaged it better it opened in the box there was no padding i ordered 3 and a bag of candy it got all over the place,2022-03-16 01:38:15.827826
B001LFHYW0,2022,3,16,1,PRE-swim = SOAK your hair with TAP water & always wear a swim cap,5.0 out of 5 stars,37 people found this helpful,"Reviewed in the United States on December 30, 2019",DriverMama,,Verified Purchase,,"After swimming for 10 weekdays, an hour daily,  without a cap, at the YMCA, my usually soft, silky, very straight hair felt, looked, & acted like straw.",2022-03-16 01:39:12.752323
B001LFHYW0,2022,3,16,2,Gets hair back under control,5.0 out of 5 stars,22 people found this helpful,"Reviewed in the United States on July 3, 2019",Beez,,Verified Purchase,,"I was in the pool quite a bit already this summer and my hair became quite dry and a mess.  I showered and shampooed after every swim but the chlorine smell was still ever-present, my scalp was becoming very dry, and it constantly itched no matter how much conditioner I used.  I ended up getting sores on my scalp.  The itching was so bad, people began to wonder if I had lice!!!",2022-03-16 01:39:12.752323
B001LFHYW0,2022,3,16,3,It works!!,5.0 out of 5 stars,36 people found this helpful,"Reviewed in the United States on October 5, 2017",Gordon Lear,,Verified Purchase,,"My son has been on a club for 6 years and now trains 25 hrs a week and his hair was 90% dead..Out of all his team mates he had the most messed up moss.  hair has been same length for years... with zero hair cuts.  It just breaks off. After a shampoo and air dry it was crispy and you could fold it.  Yes, fold it and it would stay in place.  Was exactly like shinny cardboard.  Started using TRISWIM and got fast results.  You can tell he is still a swimmer by his ""just go out of the pool"" hair style but it is part of his identity and living trophy for all the hard work.  But it is healthy (for a swimmer), growing and is looking forward to his hair cut. Best product we have found.",2022-03-16 01:39:12.752323
B001LFHYW0,2022,3,16,4,Saved my Head,5.0 out of 5 stars,42 people found this helpful,"Reviewed in the United States on May 18, 2016",Kindle Customer,,Verified Purchase,,"I've been using this product since December (so around 5 month) and I recommend it to all of my co-workers. I work as a swim instructor year-round in an indoor pool. I usually spend at least 4 hours a day, 7 days a week in the pool. Before I started using this, my hair would not grow and it was green-ish (I'm blonde so it shows up really well). Since using this my hair is back to it's natural color, and it continues to grow as it should. EVERYONE SHOULD BUY THIS!",2022-03-16 01:39:12.752323
B001LFHYW0,2022,3,16,5,Works well to remove the green from the chlorinated pool water,5.0 out of 5 stars,12 people found this helpful,"Reviewed in the United States on June 18, 2019",McPenguin5,,Verified Purchase,,"I have been swimming laps to build up my hip and thigh muscles before hip replacement surgery. I started swimming without thinking about the effect of the chlorine on my hair! I went to Amazon and selected this shampoo to help this. It does smell nice and it does keep the green out. However, I do wish it was able to do something about the  coarseness that the chlorine does. I guess I need some other product for that.",2022-03-16 01:39:12.752323
B001LFHYW0,2022,3,16,6,"Amazing Scent, Crappy Bottle",3.0 out of 5 stars,3 people found this helpful,"Reviewed in the United States on August 29, 2020",teejay,,Verified Purchase,,I love the scent of this shampoo.,2022-03-16 01:39:12.752323
B001LFHYW0,2022,3,16,7,Mean on Chlorine,5.0 out of 5 stars,,"Reviewed in the United States on December 10, 2021",Abraham,,Verified Purchase,,"After swimming daily at a fitness center’s indoor pool, I began to notice my hair becoming dry and brittle.  I went to a local hair care shop where I learned about a specially designed product called a clarifying shampoo.  Unfortunately, it was not in stock, so, like everyone else, I went to Amazon and I randomly chose TRISIM out of a wide selection of products.  Although I can’t speak to the quality of similar shampoos, I am quite satisfied with TRISWIM for several reasons.  I like the pleasant fragrance and the gently foaming action that it creates, moisturizing my hair as I massage it into my scalp.  The color is a calming baby blue, and the container is compact and lightweight.  The large flat white cap flips open and closes securely, and it also allows the container to stand surely in place. Although I can’t fairly rate it against competitive items, I am pleased with this product— and I know that in the future I’ll purchase it again.",2022-03-16 01:39:12.752323
B001LFHYW0,2022,3,16,8,Smells Good and Works Well,5.0 out of 5 stars,2 people found this helpful,"Reviewed in the United States on April 13, 2021",Amazon Customer,,Verified Purchase,,"I use this product after swim workouts and it does what it claims, which is remove residue and odors from the pool, lake, ocean. (After a 70.3 half Ironman race my hair was salty, sticky and dried out; I washed it with Triswim and went out to dinner with lovely clean hair.)",2022-03-16 01:39:12.752323
B00JJQ7OPK,2022,3,16,1,One of the three best things I've ever done for my hair,5.0 out of 5 stars,19 people found this helpful,"Reviewed in the United States on December 21, 2017",Lindy,,Verified Purchase,,"After I used this shampoo for about two weeks, I noticed a dramatic change in the texture of my hair. It was noticeably softer and silkier.",2022-03-16 01:39:20.363581
B00JJQ7OPK,2022,3,16,2,Great shampoo! I had no issues with the lather ...,5.0 out of 5 stars,13 people found this helpful,"Reviewed in the United States on March 27, 2015",studentuiu,,Verified Purchase,,"Great shampoo!  I had no issues with the lather and I wash my hair every 2 days, used 2 pumps and I have below the shoulder length colored hair. The smell is mildly antiseptic, meaning minty/tea tree/pine? Yet somehow enjoyable in shower -  the results were very decent, a nice shine and decent volume but very natural.",2022-03-16 01:39:20.363581
B00JJQ7OPK,2022,3,16,3,"Everyone Volumizing shampoo: Like the smell, do not like the waxy buildup",2.0 out of 5 stars,,"Reviewed in the United States on June 14, 2021",jjffllo,,Verified Purchase,,"I really like the scent, but I absolutely do not like the waxy greasy feeling buildup this shampoo causes for my straight hair. I think it may be the keratin? But I am not sure.",2022-03-16 01:39:20.363581
B00JJQ7OPK,2022,3,16,4,Soft healthy hair,5.0 out of 5 stars,2 people found this helpful,"Reviewed in the United States on January 11, 2018",Angel B,,Verified Purchase,,I wash my hair everyday so I love how clean my hair feels without drying it out. Nice lather and clean rinsing so my hair is soft and healthy. I would highly recommend,2022-03-16 01:39:20.363581
B00JJQ7OPK,2022,3,16,5,Drying,4.0 out of 5 stars,,"Reviewed in the United States on November 28, 2018",Lyndsi,,Verified Purchase,,"If you do not have oily hair, DO NOT BUY. If you do have oily hair, it is very good at removing all the excess; it is the only time I use conditioner on bottom half of my hair. I have very thick hair and it is slightly more difficult to get all the way through since it do not provide a lot of lather. Another plus is that it does not irritate my sensitive scalp.",2022-03-16 01:39:20.363581
B00JJQ7OPK,2022,3,16,6,Delivered Spilled,1.0 out of 5 stars,,"Reviewed in the United States on January 4, 2022",c,,Verified Purchase,,"The bottle of shampoo was open and spilled. Very disappointing especially when it is an expensive product. Because of the spill, the product is definitely not worth the price.",2022-03-16 01:39:20.363581
B00JJQ7OPK,2022,3,16,7,Great volume shampoo!,5.0 out of 5 stars,One person found this helpful,"Reviewed in the United States on October 29, 2017",Sarah,,Verified Purchase,,"Love this shampoo. It leaves my hair soft and full without damaging sulfates.  Everyone is a great brand. I haven't found a product of theirs, i didn't love.",2022-03-16 01:39:20.363581
B00JJQ7OPK,2022,3,16,8,Love it,5.0 out of 5 stars,,"Reviewed in the United States on January 6, 2019",Amazon Customer,,Verified Purchase,,"Love this shampoo! The peppermint smells so good and I appreciate how this doesn't have as many chemicals such as sulfate, perfume/fragrance, etc.",2022-03-16 01:39:20.363581
B07T3F99WV,2022,3,16,1,Beautiful Shiny Hair 🥰,5.0 out of 5 stars,One person found this helpful,"Reviewed in the United States on January 18, 2021",SweetLife,,Verified Purchase,,Finally my search is over the unending attemps spending time and money resulting in frustration. Kenra works! In simple terms. Natural silver long hair excellent condition needed shampoo wouldn't weigh down waves as well non irritating scalp which in the past happened. I don't need a conditioner with this if ever I did would definitely turn to Kenra luxe shine. My routine simple wash hair twice allow shampoo sit on hair rinse pat dry on damp hair add Kenra17Gel air dry.,2022-03-16 01:39:52.337893
B07T3F99WV,2022,3,16,2,Goddess like,5.0 out of 5 stars,3 people found this helpful,"Reviewed in the United States on November 16, 2020",Mikaela Byrd,,Verified Purchase,,"THIS STUFF IS INCREDIBLE. I HAVE NEVER SPENT SO MUCH MONEY ON SHAMPOO, BUT NOW THAT I HAVE, I CAN NEVER GO BACK! IT'S LIKE A SALON EXPERIENCE EVERY TIME I WASH MY HAIR. The lather is exhilarating. My hair is improving so much since using these products. Just. Do. It.",2022-03-16 01:39:52.337893
B07T3F99WV,2022,3,16,3,Good product,3.0 out of 5 stars,,"Reviewed in the United States on June 10, 2021",nAtTiE bYrD217,,Verified Purchase,,"Poor packaging...leaked!  Placed an order never received it.  It was three weeks before I received my shampoo. Decent product smells great. However packaging was poor pump was broke, product leaked.  Luckily I still had a little left from my other bottle which I was replacing with regard to the pump.",2022-03-16 01:39:52.337893
B07T3F99WV,2022,3,16,4,"Product great, delivered leaking",4.0 out of 5 stars,,"Reviewed in the United States on January 26, 2022",Pam,,Verified Purchase,,All great except the bottle leaked inside the plastic bag it was encased in which then leaked into the mailer which created a mess. Disappointing.,2022-03-16 01:39:52.337893
B07T3F99WV,2022,3,16,5,Love this!,5.0 out of 5 stars,,"Reviewed in the United States on July 13, 2021",Lindsey May,,Verified Purchase,,"High quality product, well made, at a better price than a salon.",2022-03-16 01:39:52.337893
B07T3F99WV,2022,3,16,6,Received shampoo today was leaking all over packaging.,3.0 out of 5 stars,,"Reviewed in the United States on March 3, 2022",Amazon Customer,,Verified Purchase,,Love this shampoo but it leaked all over,2022-03-16 01:39:52.337893
B07T3F99WV,2022,3,16,7,"El tamaño está bien para el precio, pero yo esperaba mejor suavidad .",3.0 out of 5 stars,,"Reviewed in the United States on December 1, 2020",Diana,,Verified Purchase,,Yo esperaba mejor calidad al usar el shampoo.,2022-03-16 01:39:52.337893
B07T3F99WV,2022,3,16,8,Love,5.0 out of 5 stars,4 people found this helpful,"Reviewed in the United States on January 29, 2021",Amazon Customer,,Verified Purchase,,Awesome set!! Makes my hair soft and silky! Smells good too! Worked great at untangling my long hair also!!,2022-03-16 01:39:52.337893
B01MU9VI4Q,2022,3,16,1,This shampoo does exactly what it’s designed to do!,5.0 out of 5 stars,457 people found this helpful,"Reviewed in the United States on June 24, 2018",Vic,,Verified Purchase,,"Blonde hair is a job to maintain if you naturally have a darker shade of hair. A lot of the reviews left on this product are from ladies with not enough education on how the blonde hair/purple shampoo fully work. The comments saying that it made their hair bluish/purplish and leaving negative feedback is because there’s no education behind how purple and blonde work together. The dryness of the hair after using this product is also uneducated...Who would think that by bleaching your hair and maintaining a color that’s not naturally your color is going to not dry your hair out? There’s a double edged sword here.  You want light blonde hair, here’s some things to remember when using a purple shampoo...1- the opposite of blonde is purple, so the shampoo helps brighten your dingy blonde. It’s not unusual for your hair to have hints of purple the first time through. It WILL wash out the second or third time. 2- you’re using purple shampoo to lift some brassiness off of your hair. It’s not unusual for your hair to be slightly drier when you rinse the shampoo out. Your hair WILL go back to normal the second or third wash. 3- use the purple shampoo every 3 or 4 times you wash your hair. Don’t lean on this as your daily shampoo. The more frequently you use it, the drier your hair will become. The product does exactly what it’s supposed to do if you use it correctly. I applied the shampoo on dry hair and left it on for abou 10 minutes, then washed it out and followed with conditioner. This helps brighten the hair (as well as give it the purple pigment, as it should) without diluting the shampoo with water. I was going for a brighter look. Using it to shampoo your hair in the shower for a minute will do the trick, too, but keep in mind that the shampoo gets diluted when water is added to it, causing it to not lift as much beassiness as you may want. The product does exactly what it’s designed to do, so if you feel the need to complain about the product making your hair blue/purple or drying your hair out, maybe blonde isn’t a a color option that you should continue to maintain. There’s a price to pay for beauty, so do your research!",2022-03-16 01:40:37.553610
B01MU9VI4Q,2022,3,16,2,Holy grail of toner shampoos!,5.0 out of 5 stars,154 people found this helpful,"Reviewed in the United States on August 30, 2018",Michele Panchision,,Verified Purchase,,"I’ve used countless purple toning shampoos over the years (that haven’t worked) and also never write reviews, but this stuff is too good and every blonde needs to know about it!",2022-03-16 01:40:37.553610
B01MU9VI4Q,2022,3,16,3,Don’t hesitate just buy it!,5.0 out of 5 stars,152 people found this helpful,"Reviewed in the United States on October 9, 2017",Jazzzy E,,Verified Purchase,,Love love love! After using this I had so many compliments on my hair! I had been using shimmer lights purple shampoo. After someone told me about this I just had to try it! I did leave it in extra long for that grayish purple look I’ve been wanting. But it did wonders for my blonde! Before and after pics. Also pic of packaging which was poor. Good thing I love this product so much!!,2022-03-16 01:40:37.553610
B01MU9VI4Q,2022,3,16,4,The BEST purple shampoo out there!!,5.0 out of 5 stars,75 people found this helpful,"Reviewed in the United States on December 16, 2018",Mrs. Leal,,Verified Purchase,,"By far the best brightening shampoo out there! My hair is naturally dark so in order to get the nice ash blonde hair color that I like, it has to go through a brassy-orange stage. I've tried other 'purple' shampoos and this shampoo has been the most effective. It does stain your hands a bit so I suggest using some disposable vinyl gloves. It comes with a conditioner that smells like cupcakes. I only use it for 5 mins otherwise my hair will get a slight purple tint. With a couple more washes, the purple tint will go away.",2022-03-16 01:40:37.553610
B01MU9VI4Q,2022,3,16,5,Works great if used properly!,5.0 out of 5 stars,76 people found this helpful,"Reviewed in the United States on June 10, 2018",Jenny,,Verified Purchase,,"I have dyed blonde hair that was turning brassy and yellow so I bought this shampoo/conditioner combo. I read lots of reviews and watched some YouTube videos. A lot of the videos are about how to turn your hair white or purple which isn't what I wanted, but there were some that were about how to remove the brassy color. My first tip is to start slow. The first time I used it I left it on for 1 minute, now I'm leaving it on for 3 minutes. Better safe than sorry. Play around with the timing but be cautious and go longer the next time if you're not happy with the result. Your hands turn purple, but wash them right after you apply the shampoo and it will wash off (duh).  Have a cleaning rag in the shower to wipe down all of the purple splatters, it might be hard to remove if you let it dry, so just take care of it right away. It is pretty drying, so use conditioner after you wash the shampoo out. I have been using it once a week, and that's working for me.",2022-03-16 01:40:37.553610
B01MU9VI4Q,2022,3,16,6,No yellow is right!,5.0 out of 5 stars,71 people found this helpful,"Reviewed in the United States on July 23, 2017",SunshineGirl,,Verified Purchase,,"Had my hair bleached and toned and the toner came out in a few weeks. I just used this once and it is already back to platinum! I love it! Left it in for about 5 min because I thought ""If it gets purple/blue/silver or pink who cares."" But it just made my hair less yellow! Get this stuff!",2022-03-16 01:40:37.553610
B078H4HXSM,2022,3,16,1,TV and you shampoo,5.0 out of 5 stars,179 people found this helpful,"Reviewed in the United States on June 22, 2018",Dino,,Verified Purchase,,I'm certain that  because of this shampoo  I am closer to getting my own TV show.,2022-03-16 01:41:51.513769
B078H4HXSM,2022,3,16,2,Made my hair look great but dried it out,2.0 out of 5 stars,68 people found this helpful,"Reviewed in the United States on March 30, 2019",Amy Taylor,,Verified Purchase,,"I originally wrote a 5-star review for this shampoo, but after using it for a week or so, it dried out my hair and left a white coating on my scalp, so I'm changing my rating to 2 stars.  It does make my hair very shiny and helps the flyaways, but it also makes my hair dry and a little brittle.  I've never had a problem with dry hair, so I know it's the shampoo.  I tried washing my scalp with another shampoo and then only using this one on my hair, but it still dried my hair.  I'm really disappointed, because I wanted to love it.  I don't recommend it to anyone who's prone to dry hair or scalp.",2022-03-16 01:41:51.513769
B078H4HXSM,2022,3,16,3,Average at Best,2.0 out of 5 stars,53 people found this helpful,"Reviewed in the United States on October 28, 2018",EK,,Verified Purchase,,"After reading several of the ""glowing"" reviews I decided to give this product a try. Although I can't say there is anything drastically wrong with the shampoo, there didn't seem to be anything about it that made it exceptional in my eyes. Especially when you consider the COST. I found nothing about this shampoo that made/makes it worth the $30.00 price tag. There are numerous other shampoos I like better that are a fraction of the cost of this product. I would not recommend this product to family or friends and this will NOT be a repeat buy. No issues with the seller or the transaction, just don't like the shampoo. Thanks",2022-03-16 01:41:51.513769
B078H4HXSM,2022,3,16,4,99.9% SURE THIS IS A KNOCKOFF,1.0 out of 5 stars,17 people found this helpful,"Reviewed in the United States on June 14, 2021",LD0708,,Verified Purchase,,I have been using this shampoo for almost a year and previously bought direct from R+Co’s website (for same price as here). The bottle I received was broken in shipment (never happened before) and beyond that the bottle was totally different than the bottle I got direct. Not the same color or quality. The feel and lather in the hair is also totally and 100% different. After a few week’s use my hair was totally dried out and frizzy. This was not the case at all in the last year buying direct. I stopped using this product and got some drugstore shampoo. The smell is subtly different too. While it is similar the fragrance is not as lasting or strong. I would urge everyone extreme caution in buying this from Amazon as I do NOT think it is legit AT ALL.,2022-03-16 01:41:51.513769
B078H4HXSM,2022,3,16,5,Really heavy/greasy feeling after three uses,1.0 out of 5 stars,39 people found this helpful,"Reviewed in the United States on January 25, 2019",Chandra,,Verified Purchase,,"I love all of R & Co's products so I ordered this and the matching conditioner excited to have the ""do-it-all"" miracle shampoo. I have to say immediately after use my hair was greasy, weighed down, and had a bunch of fly aways. I used it again, the next morning (even though I usually only wash my hair every third day), and it was actually worse. It looked greasy as soon as it dried and had absolutely no shape. I have fine, wavy, untreated hair, and I am so disappointed by this shampoo.",2022-03-16 01:41:51.513769
B078H4HXSM,2022,3,16,6,I got these as a Birchbox sample and liked the first try,5.0 out of 5 stars,34 people found this helpful,"Reviewed in the United States on April 7, 2018",sydney,,Verified Purchase,,"I've been a tried and true Davines customer for years. I have long, dry and processed hair. Davines has been the only product that brought life and moisture back to my hair, until I tried this. I got these as a Birchbox sample and liked the first try, so I purchased the set. This may be replacing my Nounou set! I love the smell and a little goes a long way - which is particularly important for the price and size of the bottle. So far, I love it! It's the right blend of lightweight cleansing and moisture for my tired tresses.",2022-03-16 01:41:51.513769
B078H4HXSM,2022,3,16,7,Lives up to the name!,5.0 out of 5 stars,27 people found this helpful,"Reviewed in the United States on May 24, 2018",H. Martin,,Verified Purchase,,"I have been a fan of R+Co products for some time now, so when I saw they had released a new product I knew I wanted to try it. This is a new favorite of mine! It cleanses without stripping, moisturizes without adding weight or leaving a greasy residue, and gives my hair body without making it frizzy.",2022-03-16 01:41:51.513769
