B06XZZWTL6,2022,3,16,1,This is fake... don’t buy out from Amazon.,1.0 out of 5 stars,28 people found this helpful,"Reviewed in the United States on December 20, 2020",James W.,,Verified Purchase,,"When I opened this, I noticed the spout was different. I also noticed the back was off-brand and a different language.",2022-03-16 03:34:49.186532
B06XZZWTL6,2022,3,16,2,Smelt pleasant but wasn’t the REAL DOVE !!!,3.0 out of 5 stars,12 people found this helpful,"Reviewed in the United States on December 13, 2020",Trinity,,Verified Purchase,,I don’t think this product was actually dove. It had the ingredients and directions written in another language. I wish they would stop passing off these fake products as the real name brand on Amazon. I recommend buying Dove products in store at like Walmart or Target because Amazon don’t really sell the real deal Dove 🤦🏻‍♀️😑,2022-03-16 03:34:49.186532
B06XZZWTL6,2022,3,16,3,This is FAKE DOVE BODY WASH,1.0 out of 5 stars,7 people found this helpful,"Reviewed in the United States on May 25, 2021",Kellie,,Verified Purchase,,"This is knock off Dove body wash and should be pulled from Amazon immediately. It is not nearly as thick, does not hold suds or really sud up and does not smell or moisturize like real Dove body wash. The bottle is in two languages and the push nozzle at the top is cheap knock off plastic. This is not real. Do not buy.",2022-03-16 03:34:49.186532
B06XZZWTL6,2022,3,16,4,Didn't work for us,2.0 out of 5 stars,10 people found this helpful,"Reviewed in the United States on August 2, 2020",Nicole Kosakowski,,Verified Purchase,,I bought this product with high hopes since I love Dove products but this body wash has left me and my boyfriends skin extremely itchy and dry almost moments after putting it on. Dissapointed.,2022-03-16 03:34:49.186532
B06XZZWTL6,2022,3,16,5,Smell,3.0 out of 5 stars,8 people found this helpful,"Reviewed in the United States on July 19, 2020",Sandra Atkinson,,Verified Purchase,,Not impressed with product liked the regular Dove body wash,2022-03-16 03:34:49.186532
B06XZZWTL6,2022,3,16,6,Scent is terrible....,2.0 out of 5 stars,,"Reviewed in the United States on February 3, 2022",Liz,,Verified Purchase,,"I have used Dove products, especially Dove bar soap for over 30 years, even use it to wash my face.  I also use the regular Dove body wash which has a nice scent and moisturizes my dry, sensitive skin better than any other body washes I have tried. When I got this product it was obviously not a product manufactured in the US, had I believe Arabic writing and I would have used the product but the scent was horrible. It did not smell like any lavender and lemon verbina I have ever smelled. Total waste of money. A best business practice for companies is transparency regarding products, etc. Amazon should be transparent with customers and state in description the product was not made in US, etc. Customers then have the option to purchase an item which may differ in quality from those made by Unilever in US. I cannot believe the prices on some items sold on Amazon and I can't see anyone paying almost $100 for a couple of bottles of cleaning solution, etc.  which sells for a tenth of the price in stores or online from retailers. Unbelievable. What is the rationale for such a huge markup?",2022-03-16 03:34:49.186532
B06XZZWTL6,2022,3,16,7,Very Diappointed,1.0 out of 5 stars,3 people found this helpful,"Reviewed in the United States on March 15, 2021",Carol P,,Verified Purchase,,"I bought this becausr I loved the scent when I bought it at another oulet. This has no scent. I'm very disappointed and will probably return it.  This one not only does have the ligering scent of the last bottle, it has no fragrance. No waste your money if you are looking for a fragrance.",2022-03-16 03:34:49.186532
B06XZZWTL6,2022,3,16,8,Great body wash,5.0 out of 5 stars,4 people found this helpful,"Reviewed in the United States on October 17, 2020",Vanessa,,Verified Purchase,,"I purchased the 34oz pump. I love it.  It's light and not too strong or heavy. It's sudsy so you don't have to use a ton of it and waste it. It left my skin feeling smooth after I exfoliates with their exfoliating scrub in the same scent.  I consider it a gate way though, haha. I started with this and then I moved on to some that carried more of a scent! But I will be using this one. I also use it on my 3 year old and it did not irritate her skin, a plus!",2022-03-16 03:34:49.186532
