B00NT0GV6U,2022,3,16,1,Amazing and versatile fair trade product!,5.0 out of 5 stars,22 people found this helpful,"Reviewed in the United States on June 17, 2018",H Marie,,Verified Purchase,,I love this soap! It always leaks a little shipping but I travel with it and it always leaks on me too so I can't fault them! I use the lavender scent in the winter and the tea tree eucalyptus in supper in Hope's of warding off mosquitos! I wash my face and body with this and sometimes my hair also! It's my go to for traveling because I only need this and conditioner! I also love that it is fair trade and that they list the companies impact on the bottles and have enjoyed watching the numbers go up over the time I've used their products!,2022-03-16 02:49:28.794011
B00NT0GV6U,2022,3,16,2,🎆Unbelievably soft hair,5.0 out of 5 stars,7 people found this helpful,"Reviewed in the United States on January 20, 2021",Thuy Anh Le Thai,,Verified Purchase,,Type purchased: Eucalyptus Tea tree,2022-03-16 02:49:28.794011
B00NT0GV6U,2022,3,16,3,"Amazing, helped with hair loss and scalp",5.0 out of 5 stars,8 people found this helpful,"Reviewed in the United States on June 26, 2021",Alejandra,,Verified Purchase,,"I love this product. I use it for shampoo and it has reduced my hair loss and has also helped my dry scalp. I use it twice a week and noticed a difference within two weeks. The smell is nice and I do feel the tingle from Eucalyptus but not too much but I still like it. I like how it really cleans my hair, I have thick hair and can go a week without washing and this shampoo cleans the buildup without making it too dry.",2022-03-16 02:49:28.794011
B00NT0GV6U,2022,3,16,4,Great Black Soap,5.0 out of 5 stars,One person found this helpful,"Reviewed in the United States on June 22, 2021",phdorgchem,,Verified Purchase,,"Finally found a great black soap that works well on skin! Contains tea tree oil and eucalyptus so it provides antiseptic value. Family members have used it and it has helped clear acne, breakouts, and skin related rashes from jock itch etc. It doesn't seem to dry skin. You will notice a slight medicinal smell upon dispensing from tea tree oil and Eucalyptus but that is to be expected. Don't expect it to lather like store soaps but it CLEANS VERY well! I bought the bottle with the pump, it doesn't come with one anymore. I recommend you get a pump dispenser to place on the bottle. Will make it very easy to dispense in shower. If your skin feels oily and dirty or sticky....wash with this! Does a fantastic job! I used to use Nubian but they sold out to a large company and changed all the formula's which make it HORRIBLE. So I stopped using it and moved to this. Highly recommend and I hope they continue to LEAVE the formula intact and DON'T sell out to a large company! GREAT standard soap product and I hope they continue to support the groups and families like they say they do on the side of the bottle!",2022-03-16 02:49:28.794011
B00NT0GV6U,2022,3,16,5,Awesome!!,5.0 out of 5 stars,One person found this helpful,"Reviewed in the United States on November 10, 2021",Brooke,,Verified Purchase,,"I have 3a curls and if I ever want them to look nice I have to put product upon product on, which might have something to do with the fact I only shower at night so I sleep on them wet but that’s not the point, I’ve used this stuff only twice and my curls are so pretty! The product moisturized my hair and I can already feel a texture difference! There is also literally little to no frizz at all. I did end up using it as a face wash because I forgot mine outside of the shower and I was too lazy to get it and so I used it because it says on the bottle it can be used as a face wash and my skin was legitimately clear by the morning. I had an acne scar that wouldn’t go away and two pimples that were killing my self esteem and after washing my face it felt amazing and in the morning the scar had faded to practically nothing and the pimples were completely gone! Sorry long and annoying but I am in love with this product!",2022-03-16 02:49:28.794011
B00NT0GV6U,2022,3,16,6,Bottle came damaged. But still ok,5.0 out of 5 stars,,"Reviewed in the United States on November 23, 2021",Deb M.,,Verified Purchase,,Bottle was damaged and it leaked in the box but not a lot and it's obviously still usable. Seems to be a packaging issue as I've seen a lot of reviews about broken/leaking packages.,2022-03-16 02:49:28.794011
B00NT0GV6U,2022,3,16,7,"Very moisturizing, and great for eczema",5.0 out of 5 stars,3 people found this helpful,"Reviewed in the United States on May 19, 2020",Aramatoulaye Dabo,,Verified Purchase,,"Love the scent though I wish it had more of the lavender scent, the ulang ylang neuraliazes the lavender. This soap is what got me hooked on African black soap. I have never had dry skin issues but after using Castile soap for a few days I developed eczema for the first time in my life. I tried all know nds of cream and soaps but nothing helped untill I tried alaffia's black soap and I was shocked at the immediate effect it had on my skin. My eczema was immediately soothed, skin became a little softer and was able to respond to the cream I had put on. Overall this is a great soap you won't regret buying it.",2022-03-16 02:49:28.794011
B08373R31B,2022,3,16,1,This completely dries my skin so bad......,1.0 out of 5 stars,6 people found this helpful,"Reviewed in the United States on November 18, 2020",YOYO Mike,,Verified Purchase,,"that my entire body feels like I spent 24 hours in the Salton Sea, ingested 5,000 mgs of table salt and woke up in sarcophagus in Egypt. But I sure SMELL AWESOME!!! I hate that I bought 4 of them. I even dislike using them strictly for hand soap. You actually have to put on lotion afterwards which if it doesn't match the scent ....then you just smell off. Boooooo",2022-03-16 02:49:34.904452
B08373R31B,2022,3,16,2,Works,5.0 out of 5 stars,4 people found this helpful,"Reviewed in the United States on July 23, 2020",Lynne A.,,Verified Purchase,,"This item arrived on time and in perfect condition. This is a good shower soap. Easy pump no mess. The scent isn’t as clean, nice as I would like. But this just seems to make my shower go a bit faster. I don’t feel like I have to rinse off as long with this. Yet I feel perfectly clean and fresh. I will buy again. Some mornings you just have those 3 minutes for that shower.",2022-03-16 02:49:34.904452
B08373R31B,2022,3,16,3,It smells so good!,5.0 out of 5 stars,5 people found this helpful,"Reviewed in the United States on August 29, 2020",susan d.,,Verified Purchase,,Great price and I love the scent.,2022-03-16 02:49:34.904452
B08373R31B,2022,3,16,4,Smells nice,5.0 out of 5 stars,4 people found this helpful,"Reviewed in the United States on October 22, 2020",Anna M.,,Verified Purchase,,"A good price for 4 bottles, but foaming soap always goes faster. I like the scent but I would probably go with a regular creamy soap than a foaming one next time.",2022-03-16 02:49:34.904452
B08373R31B,2022,3,16,5,Too watery.  Too many pumps required.,2.0 out of 5 stars,One person found this helpful,"Reviewed in the United States on December 2, 2021",Amazon Customer,,Verified Purchase,,I would never purchase this again.,2022-03-16 02:49:34.904452
B08373R31B,2022,3,16,6,Easier to spread all over body.,5.0 out of 5 stars,,"Reviewed in the United States on September 30, 2021",Michael J. Etzkorn,,Verified Purchase,,I hated body wash gels because it was so hard to spread it out and get the most out of your money. Smells amazing and easy to use without a wash cloth. Lathers on perfectly!,2022-03-16 02:49:34.904452
B08373R31B,2022,3,16,7,Smells good and cleans great,4.0 out of 5 stars,,"Reviewed in the United States on May 18, 2021",Rangermoed,,Verified Purchase,,I like the smell and I feel clean when I get out of the shower. I do not get any skin irritation from this product. Usually I would break out from anything with scent in it.,2022-03-16 02:49:34.904452
B08373R31B,2022,3,16,8,Would make a great foam hand wash.,3.0 out of 5 stars,,"Reviewed in the United States on May 6, 2021",Big M,,Verified Purchase,,Not enough foam to have a sudsy wash weak.,2022-03-16 02:49:34.904452
