B07WPFYX44,2022,1,20,shampoo,2,49,4802,4.6,15.26,17.98,0,1,1,0,0,0,0,0,$14.50 with Subscribe & Save discount,0,2 Piece Set,"Fri, Jan 21",($0.72/Fl Oz),"Head & Shoulders Supreme, Dry Scalp Care and Dandruff Treatment Shampoo and Conditioner Bundle, with Argan Oil and Rose Essence, Soothe and Strengthen Hair and Scalp, 11.8 Oz and 9.4 Oz",http://amazon.com/Head-Shoulders-Treatment-Conditioner-Strengthen/dp/B07WPFYX44/ref=sr_1_97?crid=3HRLZHDGH8FVG&keywords=shampoo&qid=1642657557&sprefix=shampo%2Caps%2C669&sr=8-97
B07T2L6JR1,2022,1,20,shampoo,2,50,593,4.6,29.00,0,0,1,1,0,0,0,0,0,Save more with Subscribe & Save,0,8.5 Fl Oz (Pack of 1),"Fri, Jan 21",($3.41/Fl Oz),R+Co Atlantis Moisturizing B5 Shampoo,http://amazon.com/Co-Atlantis-Moisturizing-Shampoo-8-5/dp/B07T2L6JR1/ref=sr_1_98?crid=3HRLZHDGH8FVG&keywords=shampoo&qid=1642657557&sprefix=shampo%2Caps%2C669&sr=8-98
B07F38G1RT,2022,1,20,shampoo,2,51,2068,4.8,19.78,21.99,0,1,1,0,0,0,0,0,$18.79 with Subscribe & Save discount,0,32.1 Fl Oz (Pack of 2),"Fri, Jan 21",($0.31/Fl Oz),"Head and Shoulders Shampoo, Anti Dandruff Treatment and Scalp Care, Green Apple, 32.1 fl oz, Twin Pack",http://amazon.com/Head-Shoulders-Daily-Use-Anti-Dandruff-Shampoo/dp/B07F38G1RT/ref=sr_1_99?crid=3HRLZHDGH8FVG&keywords=shampoo&qid=1642657557&sprefix=shampo%2Caps%2C669&sr=8-99
B079RJ4Y7B,2022,1,20,shampoo,2,52,6758,4.5,18.97,0,0,1,1,0,0,0,0,0,$18.02 with Subscribe & Save discount,0,33.8 Fl Oz (Pack of 1),"Fri, Jan 21",($0.56/Ounce),"Nexxus Keraphix Shampoo for Damaged Hair With ProteinFusion Keratin Protein, Black Rice, Silicone-Free 33.8 oz",http://amazon.com/Nexxus-Keraphix-Shampoo-Damaged-Hair/dp/B079RJ4Y7B/ref=sr_1_100?crid=3HRLZHDGH8FVG&keywords=shampoo&qid=1642657557&sprefix=shampo%2Caps%2C669&sr=8-100
B00TYAGMP4,2022,1,20,shampoo,2,53,12664,4.4,6.98,7.99,0,1,1,0,0,0,0,0,$6.63 with Subscribe & Save discount,0,32 Fl. Oz (Pack of 1),"Fri, Jan 21",($0.22/Fl Oz),"Renpure Originals Biotin & Collagen Thickening Shampoo, 32 Fl. Oz (Pack of 1)",http://amazon.com/Renpure-Biotin-Collagen-Shampoo-Ounce/dp/B00TYAGMP4/ref=sr_1_101?crid=3HRLZHDGH8FVG&keywords=shampoo&qid=1642657557&sprefix=shampo%2Caps%2C669&sr=8-101
B002WTC3C0,2022,1,20,shampoo,2,54,7716,4.7,29.99,42.00,0,1,1,0,0,0,0,0,Save more with Subscribe & Save,0,33.8 Fl Oz,"Fri, Jan 21",($0.89/Fl Oz),Redken Extreme Shampoo | Shampoo for Damaged Hair | Hair Strengthen & Repair Damaged Hair | Infused With Proteins,http://amazon.com/Extreme-Shampoo-Redken-Unisex-33-8/dp/B002WTC3C0/ref=sr_1_102?crid=3HRLZHDGH8FVG&keywords=shampoo&qid=1642657557&sprefix=shampo%2Caps%2C669&sr=8-102
B0752FXRQJ,2022,1,20,shampoo,2,55,3337,4.5,6.89,0,0,1,1,0,0,0,0,0,$6.55 with Subscribe & Save discount,0,28 Fl Oz (Pack of 1),"Fri, Jan 21",($0.25/Fl Oz),"L'Oréal Paris Elvive Volume Filler Thickening Cleansing Shampoo, for Fine or Thin Hair, Shampoo with Filloxane, for Thicker Fuller Hair in 1 Use, 28 fl. oz.",http://amazon.com/Paris-Thickening-Cleansing-Shampoo-Filloxane/dp/B0752FXRQJ/ref=sr_1_103?crid=3HRLZHDGH8FVG&keywords=shampoo&qid=1642657557&sprefix=shampo%2Caps%2C669&sr=8-103
B00LSV7ZQ2,2022,1,20,shampoo,2,56,363,4.4,19.99,0,0,1,1,0,0,0,0,0,Save more with Subscribe & Save,0,"Fri, Jan 21","Fri, Jan 21",($0.04/Fl Oz),"Ginger Lily Farms Club & Fitness Moisturizing Shampoo for All Hair Types, 100% Vegan & Cruelty-Free, Aloe Vera Scent, 1 Gallon (128 fl oz) Refill",http://amazon.com/Ginger-Lily-Farms-Moisturizing-Cruelty-Free/dp/B00LSV7ZQ2/ref=sr_1_104?crid=3HRLZHDGH8FVG&keywords=shampoo&qid=1642657557&sprefix=shampo%2Caps%2C669&sr=8-104
B07NJQ89D5,2022,1,20,shampoo,2,57,3761,4.5,9.09,0,0,1,1,0,0,0,0,0,$8.64 with Subscribe & Save discount,0,33.77 Fl Oz (Pack of 1),"Fri, Jan 21",($0.27/Fl Oz),"Amazon Brand - Solimo Dandruff Shampoo, Everyday Use, 33.8 Fluid Ounces",http://amazon.com/Amazon-Brand-Dandruff-Shampoo-Everyday/dp/B07NJQ89D5/ref=sr_1_105?crid=3HRLZHDGH8FVG&keywords=shampoo&qid=1642657557&sprefix=shampo%2Caps%2C669&sr=8-105
B000YDYXBK,2022,1,20,shampoo,2,58,231,4.5,6.11,7.95,0,0,0,0,0,0,0,0,23% off,0,0,0,($0.72/Fl Oz),"Giovanni, Shampoo Tea Tree Triple Treat, 8.5 Fl Oz",http://amazon.com/Giovanni-Shampoo-Tree-Triple-Treat/dp/B000YDYXBK/ref=sr_1_106_0o_wf?crid=3HRLZHDGH8FVG&keywords=shampoo&qid=1642657557&sprefix=shampo%2Caps%2C669&sr=8-106
B08P5Y3C6X,2022,1,20,shampoo,2,59,110,4.3,9.99,0,1,1,1,0,0,0,0,0,$9.49 with Subscribe & Save discount,0,13 Fl Oz (Pack of 1),"Mon, Jan 24",($0.77/Ounce),SheaMoisture Frizz Control Shampoo for Frizz Prone Hair Papaya and Neroli Sulfate Free Shampoo 13 oz,http://amazon.com/gp/slredirect/picassoRedirect.html/ref=pa_sp_btf_aps_sr_pg2_1?ie=UTF8&adId=A10076332ZMTFGWP1NH6Y&url=%2FSheaMoisture-Control-Conditioner-Papaya-Paraben%2Fdp%2FB08P5Y3C6X%2Fref%3Dsr_1_107_sspa%3Fcrid%3D3HRLZHDGH8FVG%26keywords%3Dshampoo%26qid%3D1642657557%26sprefix%3Dshampo%252Caps%252C669%26sr%3D8-107-spons%26psc%3D1&qualifier=1642657557&id=2015179338525901&widgetName=sp_btf
B08P5Y9KQG,2022,1,20,shampoo,2,60,390,4.4,8.49,9.99,1,1,1,0,0,0,0,0,$8.07 with Subscribe & Save discount,0,13 Fl Oz (Pack of 1),"Fri, Jan 21",($0.65/Ounce),"SheaMoisture Residue Remover Shampoo for Synthetic and Natural Hair, Tea Tree and Borage Seed, Sulfate Free Clarifying Shampoo, 13 Oz",http://amazon.com/gp/slredirect/picassoRedirect.html/ref=pa_sp_btf_aps_sr_pg2_1?ie=UTF8&adId=A10086491L5EGDRM85211&url=%2FSheaMoisture-Residue-Remover-Synthetic-Clarifying%2Fdp%2FB08P5Y9KQG%2Fref%3Dsr_1_108_sspa%3Fcrid%3D3HRLZHDGH8FVG%26keywords%3Dshampoo%26qid%3D1642657557%26sprefix%3Dshampo%252Caps%252C669%26sr%3D8-108-spons%26psc%3D1&qualifier=1642657557&id=2015179338525901&widgetName=sp_btf
B08P5YT5TC,2022,1,20,shampoo,3,1,124,4.3,10.99,0,1,1,1,0,0,0,0,0,$10.44 with Subscribe & Save discount,0,13 Fl Oz (Pack of 1),"Mon, Jan 24",($0.85/Fl Oz),"SheaMoisture Frizz Control Conditioner for Dry Hair, Papaya and Neroli, Sulfate Free Conditioner , 13.0 fl Ounce",http://amazon.com/gp/slredirect/picassoRedirect.html/ref=pa_sp_atf_next_aps_sr_pg3_1?ie=UTF8&adId=A02039041R6SQSRSU7J7U&url=%2FSheaMoisture-Control-Conditioner-Papaya-Sulfate%2Fdp%2FB08P5YT5TC%2Fref%3Dsr_1_97_sspa%3Fcrid%3D3HRLZHDGH8FVG%26keywords%3Dshampoo%26qid%3D1642658258%26sprefix%3Dshampo%252Caps%252C669%26sr%3D8-97-spons%26psc%3D1&qualifier=1642658258&id=1332356892988688&widgetName=sp_atf_next
B0007X749U,2022,1,20,shampoo,3,2,11566,4.7,29.99,38.00,1,1,1,0,0,0,0,0,Save more with Subscribe & Save,0,33.8 Fl Oz,"Fri, Jan 21",($0.89/Fl Oz),Redken All Soft Shampoo | For Dry/Brittle Hair | Provides Intense Softness and Shine | With Argan Oil,http://amazon.com/gp/slredirect/picassoRedirect.html/ref=pa_sp_atf_next_aps_sr_pg3_1?ie=UTF8&adId=A00642633LQVGDGL8UCFY&url=%2FRedken-Soft-Shampoo-Brittle-Hair%2Fdp%2FB0007X749U%2Fref%3Dsr_1_98_sspa%3Fcrid%3D3HRLZHDGH8FVG%26keywords%3Dshampoo%26qid%3D1642658258%26sprefix%3Dshampo%252Caps%252C669%26sr%3D8-98-spons%26psc%3D1&qualifier=1642658258&id=1332356892988688&widgetName=sp_atf_next
B0067YU4KO,2022,1,20,shampoo,3,3,2391,4.6,13.98,15.98,1,1,1,0,0,0,0,0,Save more with Subscribe & Save,0,8.45 Fl Oz (Pack of 2),"Fri, Jan 21",($0.83/Fl Oz),"John Frieda Brilliant Brunette Shampoo, Multi-Tone Color Protecting Shampoo, Helps Unlock Vibrant Color, Stocking Stuffer, 8.45 Ounce (2 Pack)",http://amazon.com/gp/slredirect/picassoRedirect.html/ref=pa_sp_atf_next_aps_sr_pg3_1?ie=UTF8&adId=A0433497TKI2SQ1AEGOL&url=%2FJohn-Frieda-Brilliant-Multi-Tone-Moisturizing%2Fdp%2FB0067YU4KO%2Fref%3Dsr_1_99_sspa%3Fcrid%3D3HRLZHDGH8FVG%26keywords%3Dshampoo%26qid%3D1642658258%26sprefix%3Dshampo%252Caps%252C669%26sr%3D8-99-spons%26psc%3D1&qualifier=1642658258&id=1332356892988688&widgetName=sp_atf_next
B0891C7XFY,2022,1,20,shampoo,3,4,2482,4.7,59.50,70.00,1,1,1,15%,0,0,0,0,Save more with Subscribe & Save,0,33.8 Fl Oz (Pack of 1),"Sat, Jan 22",($1.76/Fl Oz),"Pureology Strength Cure Shampoo | For Damaged, Color-Treated Hair | Fortifies & Strengthens Hair | Sulfate-Free | Vegan",http://amazon.com/gp/slredirect/picassoRedirect.html/ref=pa_sp_atf_next_aps_sr_pg3_1?ie=UTF8&adId=A0760888DXOK2EUH1MKP&url=%2FPureology-Color-Treated-Fortifies-Strengthens-Sulfate-Free%2Fdp%2FB0891C7XFY%2Fref%3Dsr_1_100_sspa%3Fcrid%3D3HRLZHDGH8FVG%26keywords%3Dshampoo%26qid%3D1642658258%26sprefix%3Dshampo%252Caps%252C669%26sr%3D8-100-spons%26psc%3D1&qualifier=1642658258&id=1332356892988688&widgetName=sp_atf_next
B082YG62JM,2022,1,20,shampoo,3,5,832,4.5,9.47,9.99,0,1,1,0,0,0,0,0,$9.00 with Subscribe & Save discount,0,8 Fl Oz (Pack of 1),"Fri, Jan 21",($1.18/Fl Oz),"Acure Ultra Hydrating Shampoo 100% Vegan, Ultra Hydrating Moisture & Omega Fatty Acids, , Yellow Argan Oil & Pumpkin, 8 Fl Oz",http://amazon.com/Hydrating-Shampoo-Performance-Driven-Pumpkin/dp/B082YG62JM/ref=sr_1_101?crid=3HRLZHDGH8FVG&keywords=shampoo&qid=1642658258&sprefix=shampo%2Caps%2C669&sr=8-101
B09BKNQWYM,2022,1,20,shampoo,3,6,75,3.8,109.00,0,0,1,1,0,0,0,0,0,0,0,5.3 Fl Oz (Pack of 2),"Tue, Jan 25",($10.28/Fl Oz),[2 Pack] SIMFORT SPARKLING SCALP SHAMPOO,http://amazon.com/Pack-SIMFORT-SPARKLING-SCALP-SHAMPOO/dp/B09BKNQWYM/ref=sr_1_102?crid=3HRLZHDGH8FVG&keywords=shampoo&qid=1642658258&sprefix=shampo%2Caps%2C669&sr=8-102
B07NVQVZL4,2022,1,20,shampoo,3,7,907,4.7,9.58,0,0,1,1,0,0,0,0,0,$9.10 with Subscribe & Save discount,0,22 Fl Oz (Pack of 2),"Fri, Jan 21",($0.22/Fl Oz),"Garnier Hair Care Fructis Fortifying Paraben-Free 2-in-1 Shampoo and Conditioner for Stronger Looking Hair with Touchable Softness, 22 Fl Oz, 2 Count",http://amazon.com/Garnier-Fortifying-Paraben-Free-Conditioner-Touchable/dp/B07NVQVZL4/ref=sr_1_103?crid=3HRLZHDGH8FVG&keywords=shampoo&qid=1642658258&sprefix=shampo%2Caps%2C669&sr=8-103
B081QK9539,2022,1,20,shampoo,3,8,1217,4.5,13.99,0,0,1,1,0,0,0,0,0,0,0,13.5 Fl Oz (Pack of 1),"Fri, Jan 21",($1.04/Fl Oz),"Nexxus Clean and Pure Clarifying Shampoo For Nourished Hair With ProteinFusion, Paraben-Free 13.5 oz",http://amazon.com/Nexxus-Clarifying-Nourished-ProteinFusion-Silicone/dp/B081QK9539/ref=sr_1_104_mod_primary_new?crid=3HRLZHDGH8FVG&keywords=shampoo&qid=1642658258&sbo=RZvfv%2F%2FHxDF%2BO5021pAnSA%3D%3D&sprefix=shampo%2Caps%2C669&sr=8-104
B016LH9S3A,2022,1,20,shampoo,3,9,2000,4.7,22.61,25.50,0,1,1,0,0,0,0,0,Save more with Subscribe & Save,0,33.81 Fl Oz (Pack of 1),"Fri, Jan 21",($0.67/Fl Oz),"MATRIX Total Results Color Obsessed Antioxidant Shampoo, Enhances Hair Color & Prevents Fading for Color Treated Hair",http://amazon.com/Matrix-Total-Results-Obsessed-Shampoo/dp/B016LH9S3A/ref=sr_1_105?crid=3HRLZHDGH8FVG&keywords=shampoo&qid=1642658258&sprefix=shampo%2Caps%2C669&sr=8-105
B005CWT4W6,2022,1,20,shampoo,3,10,4380,4.6,65.00,0,0,1,1,0,0,0,0,0,Save more with Subscribe & Save,0,33.8 Fl Oz (Pack of 1),"Mon, Jan 24",($1.92/Fl Oz),Moroccanoil Extra Volume Shampoo,http://amazon.com/Moroccan-Extra-Shampoo-33-8-Ounce/dp/B005CWT4W6/ref=sr_1_106?crid=3HRLZHDGH8FVG&keywords=shampoo&qid=1642658258&sprefix=shampo%2Caps%2C669&sr=8-106
B077NWRFMK,2022,1,20,shampoo,3,11,182,4.4,26.98,36.00,0,1,1,0,0,0,0,0,Save more with Subscribe & Save,0,16.9 Fl Oz (Pack of 1),"Fri, Jan 21",($1.60/Fl Oz),The Trust TS Shampoo(16.9 Fl Oz / 500mL) | Korea Shampoo | Treatment of Damaged Hair | Biotin & Natural Ingredients | Men & Women (All Hair Types),http://amazon.com/Regular-TS-Abundant-Provides-Elements/dp/B077NWRFMK/ref=sr_1_107?crid=3HRLZHDGH8FVG&keywords=shampoo&qid=1642658258&sprefix=shampo%2Caps%2C669&sr=8-107
B00SD8JO26,2022,1,20,shampoo,3,12,563,4.7,11.99,0,0,1,1,0,0,0,0,1,$11.39 with Subscribe & Save discount,0,13.5 Fl Oz (Pack of 1),"Fri, Jan 21",($0.89/Ounce),Nexxus Therappe Shampoo For Dry Hair Ultimate Moisture Silicone-Free 13.5 oz,http://amazon.com/Nexxus-Therappe-Moisture-Shampoo-Normal/dp/B00SD8JO26/ref=sr_1_108?crid=3HRLZHDGH8FVG&keywords=shampoo&qid=1642658258&sprefix=shampo%2Caps%2C669&sr=8-108
B0861HX1HL,2022,1,20,shampoo,3,13,302,4.5,7.99,8.59,0,1,1,0,0,0,0,0,$7.59 with Subscribe & Save discount,0,24 Fl Oz (Pack of 1),"Fri, Jan 21",($0.33/Ounce),"RENPURE Plant Based Coconut & Vitamin E Shampoo for Dry Hair - Sulfate Free Shampoo, Paraben Free & Color Safe - Naturally Moisturizing Coconut Hydrating Shampoo for Men & Women",http://amazon.com/Renpure-Beauty-Coconut-Vitamin-Shampoo/dp/B0861HX1HL/ref=sr_1_109?crid=3HRLZHDGH8FVG&keywords=shampoo&qid=1642658258&sprefix=shampo%2Caps%2C669&sr=8-109
B086CP746H,2022,1,20,shampoo,3,14,2692,4.5,13.66,14.99,0,1,1,0,0,0,0,0,$12.98 with Subscribe & Save discount,0,32.3 Fl Oz (Pack of 1),"Fri, Jan 21",($0.42/Ounce),"Love Beauty And Planet Volume and Bounty Thickening Shampoo For Fine Hair Coconut Water & Mimosa Flower Sulfate-Free, Paraben-Free, Vegan 32.3 oz",http://amazon.com/Love-Beauty-Planet-Sulfate-Free-Paraben-Free/dp/B086CP746H/ref=sr_1_110?crid=3HRLZHDGH8FVG&keywords=shampoo&qid=1642658258&sprefix=shampo%2Caps%2C669&sr=8-110
B077RWDFM5,2022,1,20,shampoo,3,15,5695,4.5,13.49,14.49,0,1,1,0,0,0,0,0,$12.82 with Subscribe & Save discount,0,13.5 Fl Oz (Pack of 2),"Fri, Jan 21",($0.50/Ounce),"Love Beauty And Planet Hope and Repair Shampoo and Conditioner Dry Hair and Damaged Hair Care Coconut Oil and Ylang Ylang Paraben Free, Silicone Free, and Vegan 13.5 oz, 2 count",http://amazon.com/Love-Beauty-Planet-Shampoo-Conditioner/dp/B077RWDFM5/ref=sr_1_111?crid=3HRLZHDGH8FVG&keywords=shampoo&qid=1642658258&sprefix=shampo%2Caps%2C669&sr=8-111
B07XCJSYRT,2022,1,20,shampoo,3,16,6266,4.3,24.98,0,0,1,1,0,0,0,0,0,Save more with Subscribe & Save,0,16 Fl Oz (Pack of 2),"Fri, Jan 21",($0.78/Fl Oz),"BOTANIC HEARTH Argan Oil Shampoo and Conditioner Set - with Keratin, Restorative & Moisturizing, Sulfate Free - All Hair Types & Color Treated Hair, Men and Women - (Packaging May Vary) -16 fl oz each",http://amazon.com/BOTANIC-HEARTH-Argan-Shampoo-Conditioner/dp/B07XCJSYRT/ref=sr_1_112?crid=3HRLZHDGH8FVG&keywords=shampoo&qid=1642658258&sprefix=shampo%2Caps%2C669&sr=8-112
B094F914T6,2022,1,20,shampoo,3,17,7716,4.7,46.00,0,1,0,1,0,0,0,0,0,0,0,0,0,($2.28/Fl Oz),Redken Extreme Shampoo | Shampoo for Damaged Hair | Hair Strengthen & Repair Damaged Hair | Infused With Proteins,http://amazon.com/gp/slredirect/picassoRedirect.html/ref=pa_sp_mtf_aps_sr_pg3_1?ie=UTF8&adId=A07567882C4SG5UH14447&url=%2FExtreme-Shampoo-Conditioner-Strengthen-Proteins%2Fdp%2FB094F914T6%2Fref%3Dsr_1_113_sspa%3Fcrid%3D3HRLZHDGH8FVG%26keywords%3Dshampoo%26qid%3D1642658258%26sprefix%3Dshampo%252Caps%252C669%26sr%3D8-113-spons%26psc%3D1&qualifier=1642658258&id=1332356892988688&widgetName=sp_mtf
B08XJWLLKQ,2022,1,20,shampoo,3,18,783,4.5,14.04,17.41,1,1,1,0,0,0,0,0,0,0,8.45 Fl Oz (Pack of 2),"Sat, Jan 22",($0.83/Fl Oz),"John Frieda Detox and Repair Shampoo and Conditioner Set with Nourishing Avocado Oil and Green Tea, Stocking Stuffer, 8.45 oz",http://amazon.com/gp/slredirect/picassoRedirect.html/ref=pa_sp_mtf_aps_sr_pg3_1?ie=UTF8&adId=A0068702URVW2IOVGB0J&url=%2FJohn-Frieda-Shampoo-Conditioner-Nourishing%2Fdp%2FB08XJWLLKQ%2Fref%3Dsr_1_114_sspa%3Fcrid%3D3HRLZHDGH8FVG%26keywords%3Dshampoo%26qid%3D1642658258%26sprefix%3Dshampo%252Caps%252C669%26sr%3D8-114-spons%26psc%3D1&qualifier=1642658258&id=1332356892988688&widgetName=sp_mtf
B00FH692PQ,2022,1,20,shampoo,3,19,20578,4.3,29.00,39.99,1,1,1,0,0,1,0,0,0,0,16 Fl Oz (Pack of 1),"Fri, Jan 28",($1.81/Fl Oz),"PURA D'OR Original Gold Label Anti-Thinning Biotin Shampoo (16oz) w/ Argan Oil, Nettle Extract, Saw Palmetto, Red Seaweed, 17+ DHT Herbal Actives, No Sulfates, Natural Preservatives, For Men & Women",http://amazon.com/gp/slredirect/picassoRedirect.html/ref=pa_sp_mtf_aps_sr_pg3_1?ie=UTF8&adId=A07711862KCOKU0OTW1FF&url=%2FPURA-DOR-Anti-Thinning-Clinically-Ingredients%2Fdp%2FB00FH692PQ%2Fref%3Dsr_1_115_sspa%3Fcrid%3D3HRLZHDGH8FVG%26keywords%3Dshampoo%26qid%3D1642658258%26sprefix%3Dshampo%252Caps%252C669%26sr%3D8-115-spons%26psc%3D1%26smid%3DA23IQE0YUV800G&qualifier=1642658258&id=1332356892988688&widgetName=sp_mtf
B000BIUGUU,2022,1,20,shampoo,3,20,895,4.5,29.26,0,0,0,1,0,0,0,0,0,0,0,8.5 Fl Oz (Pack of 1),0,($3.44/Fl Oz),Bumble and Bumble Thickening Volume Shampoo 8.5 oz.,http://amazon.com/Bumble-Thickening-Shampoo-8-5-oz/dp/B000BIUGUU/ref=sr_1_116?crid=3HRLZHDGH8FVG&keywords=shampoo&qid=1642658258&sprefix=shampo%2Caps%2C669&sr=8-116
B00ZFNU71Y,2022,1,20,shampoo,3,21,1027,4.4,9.44,9.99,0,1,1,0,0,0,0,0,Save more with Subscribe & Save,0,11 Ounce,"Fri, Jan 21",($0.86/Fl Oz),"Avalon Organics Natural Shampoo, Volumizing Rosemary, 11 Oz",http://amazon.com/Avalon-Organics-Volumizing-Rosemary-Shampoo/dp/B00ZFNU71Y/ref=sr_1_117?crid=3HRLZHDGH8FVG&keywords=shampoo&qid=1642658258&sprefix=shampo%2Caps%2C669&sr=8-117
B07L6SWWRV,2022,1,20,shampoo,3,22,1600,4.7,19.00,0,0,1,1,0,0,0,0,0,0,0,8.5 Ounce (Pack of 1),"Sat, Jan 22",($2.24/Fl Oz),Aveda Rosemary Mint Purifying Shampoo 8.5 Ounce,http://amazon.com/Aveda-Rosemary-Mint-Purifying-Shampoo/dp/B07L6SWWRV/ref=sr_1_118?crid=3HRLZHDGH8FVG&keywords=shampoo&qid=1642658258&sprefix=shampo%2Caps%2C669&sr=8-118
B082YFN2ZK,2022,1,20,shampoo,3,23,2097,4.4,9.29,9.99,0,1,1,0,0,0,0,0,$8.83 with Subscribe & Save discount,0,8 Fl Oz (Pack of 1),"Fri, Jan 21",($1.16/Fl Oz),"ACURE Curiously Clarifying Shampoo, Lemongrass & Argan, 100% Vegan, Performance Driven Hair Care, Gently Cleanses, Removes Buildup, Boost Shine & Replenishes Moisture, 8 Fl Oz",http://amazon.com/ACURE-Curiously-Clarifying-Shampoo-Performance/dp/B082YFN2ZK/ref=sr_1_119?crid=3HRLZHDGH8FVG&keywords=shampoo&qid=1642658258&sprefix=shampo%2Caps%2C669&sr=8-119
B08LHX596H,2022,1,20,shampoo,3,24,997,4.6,14.44,0,0,1,1,0,0,0,0,0,Save more with Subscribe & Save,0,21.9 Fl Oz (Pack of 2),"Fri, Jan 21",($0.33/Fl Oz),"Old Spice Reinvigorate Shampoo for Men with Tea Tree Oil, 21.9 Oz Each, Twin Pack",http://amazon.com/Old-Spice-Reinvigorate-Shampoo-Tree/dp/B08LHX596H/ref=sr_1_120?crid=3HRLZHDGH8FVG&keywords=shampoo&qid=1642658258&sprefix=shampo%2Caps%2C669&sr=8-120
B00KWT8E8O,2022,1,20,shampoo,3,25,873,4.8,24.97,40.62,0,1,1,0,0,0,0,0,0,0,34 Fl Oz (Pack of 1),"Fri, Jan 21",($0.73/Fl Oz),"Biosilk Silk Therapy, Shampoo, 34 Fluid Ounce",http://amazon.com/Biosilk-Therapy-Shampoo-Fluid-Ounce/dp/B00KWT8E8O/ref=sr_1_121_mod_primary_new?crid=3HRLZHDGH8FVG&keywords=shampoo&qid=1642658258&sbo=RZvfv%2F%2FHxDF%2BO5021pAnSA%3D%3D&sprefix=shampo%2Caps%2C669&sr=8-121
B08J115RZL,2022,1,20,shampoo,3,26,1836,4.7,17.54,18.99,0,1,1,0,0,0,0,0,Save more with Subscribe & Save,0,2 Count (Pack of 1),"Fri, Jan 21",($0.65/Fl Oz),"Head & Shoulders Clinical Strength Dandruff Shampoo Set Itensive Itch Relief with Cooling Menthol 13.5 Oz Each Twin Pack, White, 1 Count",http://amazon.com/Head-Shoulders-Clinical-Strength-Dandruff/dp/B08J115RZL/ref=sr_1_122?crid=3HRLZHDGH8FVG&keywords=shampoo&qid=1642658258&sprefix=shampo%2Caps%2C669&sr=8-122
B07DTJM47S,2022,1,20,shampoo,3,27,1285,4.8,15.99,0,0,1,1,0,0,0,0,0,$15.19 with Subscribe & Save discount,0,18 Fl Oz (Pack of 1),"Fri, Jan 21",($0.89/Fl Oz),The Honest Company Ultra Dreamy Calming Lavender Shampoo + Body Wash | Tear-Free Baby Shampoo with Naturally Derived Ingredients | Sulfate- & Paraben-Free Baby Bath | 18 Fl Oz (Pack of 1),http://amazon.com/Lavender-Tear-Free-Naturally-Ingredients-Paraben-Free/dp/B07DTJM47S/ref=sr_1_123?crid=3HRLZHDGH8FVG&keywords=shampoo&qid=1642658258&sprefix=shampo%2Caps%2C669&sr=8-123
B002WTC3AW,2022,1,20,shampoo,3,28,5651,4.7,29.99,38.00,0,1,1,0,0,0,0,0,Save more with Subscribe & Save,0,33.8 Fl Oz (Pack of 1),"Fri, Jan 21",($0.89/Fl Oz),Redken Color Extend Shampoo | For Color-Treated Hair | Cleanses Hair Leaving It Manageable & Shiny,http://amazon.com/REDKEN-Shampoo-Color-Treated-Cleanses-Manageable/dp/B002WTC3AW/ref=sr_1_124?crid=3HRLZHDGH8FVG&keywords=shampoo&qid=1642658258&sprefix=shampo%2Caps%2C669&sr=8-124
B0861HCQLQ,2022,1,20,shampoo,3,29,298,4.6,8.99,0,0,1,1,0,0,0,0,0,$8.54 with Subscribe & Save discount,0,24 Fl Oz (Pack of 1),"Fri, Jan 21",($1.50/Ounce),"RENPURE Plant Based Beauty Rose Water Hydrating Shampoo, 24 Oz.",http://amazon.com/Renpure-Plant-Based-Beauty-Shampoo/dp/B0861HCQLQ/ref=sr_1_125?crid=3HRLZHDGH8FVG&keywords=shampoo&qid=1642658258&sprefix=shampo%2Caps%2C669&sr=8-125
B08P35DNQR,2022,1,20,shampoo,3,30,551,4.8,25.99,29.98,0,1,1,0,0,0,0,0,Save more with Subscribe & Save,0,1.96 Pound (Pack of 1),"Fri, Jan 21",($25.99/Count),"Head & Shoulders Royal Oils Dandruff Shampoo & Conditioner Set with Coconut Oil and Apple Cider Vinegar, Curly Hair Products, 31.4 Oz Each",http://amazon.com/Head-Shoulders-Dandruff-Conditioner-Products/dp/B08P35DNQR/ref=sr_1_126?crid=3HRLZHDGH8FVG&keywords=shampoo&qid=1642658258&sprefix=shampo%2Caps%2C669&sr=8-126
B07XB2Q542,2022,1,20,shampoo,3,31,11922,4.4,NOPRICE,0,0,0,0,0,0,0,0,0,0,0,13 Fl Oz (Pack of 1),0,0,"OGX Thick & Full + Biotin & Collagen Extra Strength Volumizing Shampoo with Vitamin B7 & Hydrolyzed Wheat Protein for Fine Hair. Sulfate-Free Surfactants for Thicker, Fuller Hair, 13 Fl Oz",http://amazon.com/OGX-Volumizing-Hydrolyzed-Sulfate-Free-Surfactants/dp/B07XB2Q542/ref=sr_1_127?crid=3HRLZHDGH8FVG&keywords=shampoo&qid=1642658258&sprefix=shampo%2Caps%2C669&sr=8-127
B097YJZLPR,2022,1,20,shampoo,3,32,18743,4.3,13.38,14.98,1,1,1,0,0,0,0,0,$12.71 with Subscribe & Save discount,0,8.45 Fl Oz (Pack of 1),"Fri, Jan 21",($0.79/Fl Oz),"John Frieda Volume Lift Shampoo for Natural Fullness, Safe for Colour-Treated Hair, Volumizing Shampoo for Fine or Flat Hair, Stocking Stuffer, 8.45 Ounces (Pack of 2)",http://amazon.com/gp/slredirect/picassoRedirect.html/ref=pa_sp_mtf_aps_sr_pg3_1?ie=UTF8&adId=A0139710GTEGTHRAZLCC&url=%2FJohn-Frieda-Fullness-Colour-Treated-Volumizing%2Fdp%2FB097YJZLPR%2Fref%3Dsr_1_128_sspa%3Fcrid%3D3HRLZHDGH8FVG%26keywords%3Dshampoo%26qid%3D1642658258%26sprefix%3Dshampo%252Caps%252C669%26sr%3D8-128-spons%26psc%3D1&qualifier=1642658258&id=1332356892988688&widgetName=sp_mtf
B091V9TL6R,2022,1,20,shampoo,3,33,24924,4.8,49.98,64.00,1,0,1,0,0,0,0,0,0,0,0,0,($0.74/Fl Oz),BIOLAGE Colorlast Shampoo | Helps Protect Hair & Maintain Vibrant Color | For Color-Treated Hair | Paraben & Silicone-Free | Vegan​,http://amazon.com/gp/slredirect/picassoRedirect.html/ref=pa_sp_mtf_aps_sr_pg3_1?ie=UTF8&adId=A09030773SBLX9SBAMR8Q&url=%2FBIOLAGE-Colorlast-Conditioner-Paraben-Free-Color-Treated%2Fdp%2FB091V9TL6R%2Fref%3Dsr_1_129_sspa%3Fcrid%3D3HRLZHDGH8FVG%26keywords%3Dshampoo%26qid%3D1642658258%26sprefix%3Dshampo%252Caps%252C669%26sr%3D8-129-spons%26psc%3D1&qualifier=1642658258&id=1332356892988688&widgetName=sp_mtf
B091V8JN2Q,2022,1,20,shampoo,3,34,422,4.8,49.16,64.00,1,0,1,0,0,0,0,0,0,0,0,0,($0.73/Ounce),BIOLAGE Ultra Hydrasource Shampoo & Conditioner Bundle | Extremely Moisturizes Hair To Prevent Breakage | Silicone & Paraben-Free | For Very Dry Hair | 33.8 Fl. Oz.,http://amazon.com/gp/slredirect/picassoRedirect.html/ref=pa_sp_mtf_aps_sr_pg3_1?ie=UTF8&adId=A0882562O3KUISDCY6F9&url=%2FBIOLAGE-Hydrasource-Conditioner-Moisturizes-Paraben-Free%2Fdp%2FB091V8JN2Q%2Fref%3Dsr_1_130_sspa%3Fcrid%3D3HRLZHDGH8FVG%26keywords%3Dshampoo%26qid%3D1642658258%26sprefix%3Dshampo%252Caps%252C669%26sr%3D8-130-spons%26psc%3D1&qualifier=1642658258&id=1332356892988688&widgetName=sp_mtf
B012HPGFIQ,2022,1,20,shampoo,3,35,3382,4.5,24.99,35.00,0,1,1,29%,0,0,0,0,Save more with Subscribe & Save,0,33.8 Fl Oz,"Fri, Jan 21",($0.74/Fl Oz),"BIOLAGE Advanced Full Density Thickening Shampoo |Removes Impurities For Thicker, Fuller-Looking Hair | For Thin Hair | Paraben-Free | Vegan",http://amazon.com/BIOLAGE-Advanced-Density-Thickening-Shampoo/dp/B012HPGFIQ/ref=sr_1_131?crid=3HRLZHDGH8FVG&keywords=shampoo&qid=1642658258&sprefix=shampo%2Caps%2C669&sr=8-131
B07KYGWQ7H,2022,1,20,shampoo,3,36,1181,4.8,23.96,27.96,0,1,1,0,0,0,0,0,$22.76 with Subscribe & Save discount,0,30.4 Fl Oz (Pack of 4),"Fri, Jan 21",($0.20/Fl Oz),"Aussie Paraben-Free Miracle Moist Shampoo with Avocado & Jojoba for Dry Hair, 30.4 Fluid Ounce, (Pack of 4)",http://amazon.com/Aussie-Paraben-Free-Miracle-Shampoo-Avocado/dp/B07KYGWQ7H/ref=sr_1_132?crid=3HRLZHDGH8FVG&keywords=shampoo&qid=1642658258&sprefix=shampo%2Caps%2C669&sr=8-132
B00MBOLWVE,2022,1,20,shampoo,3,37,3509,4.5,6.98,7.99,0,1,1,0,0,0,0,0,$6.63 with Subscribe & Save discount,0,32 Fl Oz (Pack of 1),"Fri, Jan 21",($0.22/Fl Oz),"Renpure Coconut Cream Nourishing Shampoo, 32 Ounces",http://amazon.com/Renpure-Coconut-Cream-Nourishing-Shampoo/dp/B00MBOLWVE/ref=sr_1_133?crid=3HRLZHDGH8FVG&keywords=shampoo&qid=1642658258&sprefix=shampo%2Caps%2C669&sr=8-133
B07SRFXWXQ,2022,1,20,shampoo,3,38,3949,4.4,20.00,0,0,1,1,0,0,0,0,0,$19.00 with Subscribe & Save discount,0,3.2 Ounce (Pack of 1),"Mon, Jan 24",($6.25/Ounce),"Klorane Dry Shampoo with Oat Milk, Ultra-Gentle, All Hair Types, No White Residue, Paraben & Sulfate-Free",http://amazon.com/Klorane-Shampoo-Ultra-Gentle-Residue-Sulfate-Free/dp/B07SRFXWXQ/ref=sr_1_134?crid=3HRLZHDGH8FVG&keywords=shampoo&qid=1642658258&sprefix=shampo%2Caps%2C669&sr=8-134
B019FGCTVM,2022,1,20,shampoo,3,39,2395,4.7,11.64,0,0,1,1,0,0,0,0,0,$11.06 with Subscribe & Save discount,0,30 Fl Oz (Pack of 6),"Fri, Jan 21",($0.06/Ounce),"Suave Essentials Shampoo Shampoo for Dry Hair Strawberry Infused with Strawberry Extract and Vitamin E, 30 oz, Pack of 6",http://amazon.com/Suave-Essentials-Shampoo-Strawberry-Pack/dp/B019FGCTVM/ref=sr_1_135?crid=3HRLZHDGH8FVG&keywords=shampoo&qid=1642658258&sprefix=shampo%2Caps%2C669&sr=8-135
B019WYTRN0,2022,1,20,shampoo,3,40,852,4.1,49.99,0,0,1,1,0,0,0,0,0,Save more with Subscribe & Save,0,17.5 Fl Oz (Pack of 1),"Fri, Jan 21",($49.99/Count),Laritelle Organic Shampoo Sensual Bliss 17.5 oz,http://amazon.com/Laritelle-Rosemary-Palmarosa-Promotes-Prevents/dp/B019WYTRN0/ref=sr_1_136?crid=3HRLZHDGH8FVG&keywords=shampoo&qid=1642658258&sprefix=shampo%2Caps%2C669&sr=8-136
B07G2JYLTS,2022,1,20,shampoo,3,41,108,4.4,9.99,11.99,0,1,1,0,0,0,0,0,0,0,13 Fl Oz (Pack of 1),"Sat, Jan 22",($0.77/Ounce),"Sheamoisture, Shampoo Daily Hydration, 13 Fl Oz",http://amazon.com/Sheamoisture-Shampoo-Daily-Hydration-13/dp/B07G2JYLTS/ref=sr_1_137?crid=3HRLZHDGH8FVG&keywords=shampoo&qid=1642658258&sprefix=shampo%2Caps%2C669&sr=8-137
