B09MB2VHJQ,2022,3,16,body wash,10,1,0,0,11.99,18.99,1,1,1,0,0,0,0,0,5% coupon applied at checkout,Save 5%  with coupon,"Tomorrow, Mar 16","Tomorrow, Mar 16",($2.42/Fl Oz),"MANCODES Foaming Facial Cleanser, Makeup Remover and Daily Face Wash for Oily Skin, Paraben & Fragrance Free, Salicylic Acid Blackhead Cleaner 4.76 Fl Oz",http://amazon.com/gp/slredirect/picassoRedirect.html/ref=pa_sp_atf_next_beauty_sr_pg10_1?ie=UTF8&adId=A08437492Q00GAGTAQD0I&url=%2FMANCODES-Cleanser-Fragrance-Salicylic-Blackhead%2Fdp%2FB09MB2VHJQ%2Fref%3Dsr_1_433_sspa%3Fkeywords%3DBody%2BCleansers%26qid%3D1647370885%26s%3Dbeauty%26sr%3D1-433-spons%26psc%3D1&qualifier=1647370885&id=8179940487462329&widgetName=sp_atf_next,2022-03-16 03:01:33.105734
B09CY6LZZ4,2022,3,16,body wash,10,2,3,2.0,8.99,0,1,1,1,0,0,0,0,0,0,0,"Thu, Mar 17","Thu, Mar 17",($8.99/Fl Oz),"MENSTORY Activated Charcoal Face Exfoliator Rub Facial Scrub for Exfoliating, Smoothing, Purifying, Reducing Dullness, Dryness, Blackheads, Oily & Acne Skincare for Men, 1 oz",http://amazon.com/gp/slredirect/picassoRedirect.html/ref=pa_sp_atf_next_beauty_sr_pg10_1?ie=UTF8&adId=A04895032ZITNUGC070Y8&url=%2FMENSTORY-Activated-Exfoliator-Exfoliating-Blackheads%2Fdp%2FB09CY6LZZ4%2Fref%3Dsr_1_434_sspa%3Fkeywords%3DBody%2BCleansers%26qid%3D1647370885%26s%3Dbeauty%26sr%3D1-434-spons%26psc%3D1&qualifier=1647370885&id=8179940487462329&widgetName=sp_atf_next,2022-03-16 03:01:37.284976
B09HRB71DM,2022,3,16,body wash,10,3,9,4.6,36.50,0,1,1,1,0,0,0,0,0,6% coupon applied at checkout,Save 6%  with coupon,"Tomorrow, Mar 16","Tomorrow, Mar 16",0,"Natural Amor Handmade Spa Gift Set, Relaxing 5 pcs Gift Box for Women Including Lavender Handmade Soap Bar, Natural Clay Mask, Soy Candle, Bath Salt",http://amazon.com/gp/slredirect/picassoRedirect.html/ref=pa_sp_atf_next_beauty_sr_pg10_1?ie=UTF8&adId=A10241302EWLITL4FF5H4&url=%2FNatural-Handmade-Relaxing-Including-Lavender%2Fdp%2FB09HRB71DM%2Fref%3Dsr_1_436_sspa%3Fkeywords%3DBody%2BCleansers%26qid%3D1647370885%26s%3Dbeauty%26sr%3D1-436-spons%26psc%3D1&qualifier=1647370885&id=8179940487462329&widgetName=sp_atf_next,2022-03-16 03:01:41.492237
B09BC4DZF6,2022,3,16,body wash,10,4,6,4.6,28.48,29.97,0,0,1,0,0,0,0,0,0,0,6.8 Fl Oz (Pack of 3),0,0,"Weleda Aroma Essentials Body Wash Collection, 6.8 Fluid Ounce (Pack of 3), Energy Shower Gel, Pamper and Relax Body Wash, Gentle Plant Rich Cleanser",http://amazon.com/Weleda-Essentials-Collection-Energy-Cleanser/dp/B09BC4DZF6/ref=sr_1_437?keywords=Body+Cleansers&qid=1647370885&s=beauty&sr=1-437,2022-03-16 03:01:45.704778
B01LTHKWE6,2022,3,16,body wash,10,5,50,4.5,21.68,0,0,1,1,0,0,0,0,0,0,0,11.97 Fl Oz (Pack of 3),"Tomorrow, Mar 16",($0.60/Ounce),"Aveeno Daily Moisturizing Yogurt Body Wash for Dry Skin with Soothing Oat & Vanilla Scent, Gentle Body Cleanser, 12 fl. oz (Pack of 3)",http://amazon.com/Aveeno-Daily-Moisturizing-Yogurt-Vanilla/dp/B01LTHKWE6/ref=sr_1_438?keywords=Body+Cleansers&qid=1647370885&s=beauty&sr=1-438,2022-03-16 03:01:49.919391
B001E96L2C,2022,3,16,body wash,10,6,492,4.7,20.67,0,0,1,1,0,0,0,0,0,0,0,Pack of 3,"Tomorrow, Mar 16",($1.72/Ounce),"Aveeno Active Naturals Skin Relief Body Wash, Fragrance Free, 12 Ounce (Pack of 3)",http://amazon.com/Aveeno-Active-Naturals-Relief-Fragrance/dp/B001E96L2C/ref=sr_1_439?keywords=Body+Cleansers&qid=1647370885&s=beauty&sr=1-439,2022-03-16 03:01:54.130633
B00ZJTD824,2022,3,16,body wash,10,7,54,4.3,11.00,0,0,0,1,0,0,0,0,0,0,0,8 Fl Oz (Pack of 1),0,($1.38/FL Oz),"Cleure Face and Body Wash for Sensitive Skin, Free of Fragrance, Gluten, Paraben and Sulfates, 8 oz",http://amazon.com/Cleure-Face-Body-Wash-Hypoallergenic/dp/B00ZJTD824/ref=sr_1_440?keywords=Body+Cleansers&qid=1647370885&s=beauty&sr=1-440,2022-03-16 03:02:01.476899
B003B6FFNC,2022,3,16,body wash,10,8,1025,4.6,16.99,0,0,1,1,0,0,0,0,0,Save more with Subscribe & Save,0,32 Fl Oz (Pack of 1),"Tomorrow, Mar 16",($0.53/Fl. Oz),"Alaffia - Everyday Shea Body Wash, Naturally Helps Moisturize and Cleanse Without Stripping Natural Oils with Shea Butter, Neem, and Coconut Oil, Fair Trade, Lavender, 32 Ounces",http://amazon.com/Alaffia-Everyday-Naturally-Moisturize-Stripping/dp/B003B6FFNC/ref=sr_1_441?keywords=Body+Cleansers&qid=1647370885&s=beauty&sr=1-441,2022-03-16 03:02:05.668755
B00EII96N2,2022,3,16,body wash,10,9,1232,4.6,11.72,12.99,0,0,1,0,0,0,0,0,0,0,8 Fl Oz (Pack of 2),0,($0.73/Fl Oz),"No-Rinse Body Wash, 8 fl oz - Leaves Skin Clean, Moisturized and Odor-Free (Pack of 2)",http://amazon.com/No-Rinse-Body-Bottles-bottles/dp/B00EII96N2/ref=sr_1_442?keywords=Body+Cleansers&qid=1647370885&s=beauty&sr=1-442,2022-03-16 03:02:13.560953
B01BI7K1WU,2022,3,16,body wash,10,10,322,4.3,12.99,0,0,1,1,0,0,0,0,0,0,0,4 Ounce (Pack of 1),"Tomorrow, Mar 16",($3.25/Ounce),"Moisturizing Rosacea Face & Body Wash for Sensitive Skin With Coconut Oil, Manuka Honey and Aloe Vera - Gentle Rosacea Cleanser for Dry & Itchy Skin - Redness Relief for Face & Body (4oz)",http://amazon.com/Moisturizing-Rosacea-Sensitive-Coconut-Manuka/dp/B01BI7K1WU/ref=sr_1_443?keywords=Body+Cleansers&qid=1647370885&s=beauty&sr=1-443,2022-03-16 03:02:17.740797
B076X57T6J,2022,3,16,body wash,10,11,560,4.4,6.95,0,0,1,1,0,0,0,0,0,Save more with Subscribe & Save,0,8 Ounce (Pack of 1),"Thu, Mar 17",($0.87/Ounce),"African Black Soap Paste 8 oz. 100% Raw Pure Natural From Ghana. Acne Treatment, Aids Against Eczema & Psoriasis, Dry Skin, Scars and Dark Spots. Great For Pimples, Blackhead, Face & Body Wash.",http://amazon.com/African-Black-Soap-Paste-Ghana/dp/B076X57T6J/ref=sr_1_444?keywords=Body+Cleansers&qid=1647370885&s=beauty&sr=1-444,2022-03-16 03:02:21.949757
B00F57OWWK,2022,3,16,body wash,10,12,730,4.6,36.00,0,0,1,1,0,0,0,0,0,Save more with Subscribe & Save,0,16 Fl Oz (Pack of 1),"Tomorrow, Mar 16",($2.25/Fl Oz),"Malin + Goetz Rum Hand + Body Wash, soothing hydrating body soap for men and women, prevents dry skin, no stripping or irritation. Natural ingredients, cruelty-free, vegan",http://amazon.com/Malin-Goetz-Body-Wash-Rum/dp/B00F57OWWK/ref=sr_1_445?keywords=Body+Cleansers&qid=1647370885&s=beauty&sr=1-445,2022-03-16 03:02:26.138386
B01DCHU1DI,2022,3,16,body wash,10,13,17,4.6,22.00,28.00,0,0,1,0,0,0,0,0,0,0,5 Ounce,0,($4.40/Ounce),Origins Gloomaway Grapefruit Body-Buffing Cleanser Unisex Cleanser 5 oz,http://amazon.com/ORIGINS-Gloomaway-Grapefruit-Body-Buffing-Cleanser/dp/B01DCHU1DI/ref=sr_1_446?keywords=Body+Cleansers&qid=1647370885&s=beauty&sr=1-446,2022-03-16 03:02:30.352338
B081KLSGM5,2022,3,16,body wash,10,14,786,4.6,12.09,0,0,1,1,0,0,0,0,0,$11.49 with Subscribe & Save discount,0,3.5 Ounce (Pack of 1),"Tomorrow, Mar 16",($3.45/Ounce),"Sulfo-Lo Cleansing Bar Soap with Sulfur for Face and Body, 3.5 Ounce",http://amazon.com/Sulfo-Lo-Cleansing-Multiple-Conditions/dp/B081KLSGM5/ref=sr_1_447?keywords=Body+Cleansers&qid=1647370885&s=beauty&sr=1-447,2022-03-16 03:02:37.050843
B0847SLCNN,2022,3,16,body wash,10,15,82,4.5,20.00,22.66,0,1,1,12%,0,0,0,0,Lowest price in 30 days,0,25.36 Fl Oz (Pack of 3),"Tomorrow, Mar 16",($0.26/Fl Oz),"Nivea Bath Cream Body Wash, Creme Care Original Scent - 25.36 Ounce (750ml) x Pack of 3",http://amazon.com/Nivea-Cream-Creme-Original-Scent/dp/B0847SLCNN/ref=sr_1_448?keywords=Body+Cleansers&qid=1647370885&s=beauty&sr=1-448,2022-03-16 03:02:41.252935
B000BIX0HQ,2022,3,16,body wash,10,16,61,4.9,76.57,99.00,0,1,1,0,0,0,0,0,Save more with Subscribe & Save,Save 50%  with coupon,128 Fl Oz (Pack of 1),"Tomorrow, Mar 16",($0.60/Ounce),"Vitabath Spa Skin Therapy Bath & Shower Gelee Moisturizing Body Cleanser Infused with Floral Extracts & Sandalwood - Cruelty-Free, Paraben-Free - 128 oz",http://amazon.com/Vitabath-Skin-Therapy-Gallon-Ounce/dp/B000BIX0HQ/ref=sr_1_449?keywords=Body+Cleansers&qid=1647370885&s=beauty&sr=1-449,2022-03-16 03:02:45.466780
B08JK3F3P2,2022,3,16,body wash,10,17,142,4.8,13.80,14.84,0,1,1,0,0,0,0,0,0,0,10 Fl Oz (Pack of 1),"Thu, Mar 17",($13.80/Fl Oz),Bath and Body Works Men's Collection Graphite 3-in-1 Hair Face and Body Wash 10 Fluid Ounce,http://amazon.com/Bath-Body-Works-Collection-Graphite/dp/B08JK3F3P2/ref=sr_1_450?keywords=Body+Cleansers&qid=1647370885&s=beauty&sr=1-450,2022-03-16 03:02:49.676975
B08T1PQY73,2022,3,16,body wash,10,18,171,4.2,8.95,0,0,1,1,0,0,0,0,0,Save more with Subscribe & Save,0,4 Ounce (Pack of 1),"Thu, Mar 17",($2.24/Ounce),"Cactus Honey & Oats Goat's Milk Soap Bar 4 oz – Natural Bar Soap for Women, Men, Kids, Itchy Skin, Eczema, Psoriasis, Rash, Sunburn Skincare – Calming Colloidal Oatmeal Face Cleanser & Body Wash",http://amazon.com/Cactus-Honey-Oats-Goats-Milk/dp/B08T1PQY73/ref=sr_1_451?keywords=Body+Cleansers&qid=1647370885&s=beauty&sr=1-451,2022-03-16 03:02:53.893668
B08PCPW8KL,2022,3,16,body wash,10,19,499,4.8,31.88,33.76,0,1,1,0,0,0,0,0,Save more with Subscribe & Save,0,17.9 Fl Oz (Pack of 4),"Tomorrow, Mar 16",($7.97/Count),"Olay Exfoliating & Hydrating Body Wash With Deep Sea Minerals, Coconut Water, and Vitamin B3 17.9 Fl Ounce , 4 count",http://amazon.com/Olay-Exfoliating-Hydrating-Minerals-Coconut/dp/B08PCPW8KL/ref=sr_1_452?keywords=Body+Cleansers&qid=1647370885&s=beauty&sr=1-452,2022-03-16 03:02:58.106838
B01AWTH9KW,2022,3,16,body wash,10,20,1098,4.7,20.00,0,0,1,1,0,0,0,0,0,$19.00 with Subscribe & Save discount,0,16 Fl Oz (Pack of 1),"Tomorrow, Mar 16",($1.25/Ounce),"philosophy fresh cream - shower gel, 16 Oz",http://amazon.com/philosophy-fresh-cream-shower-gel/dp/B01AWTH9KW/ref=sr_1_453?keywords=Body+Cleansers&qid=1647370885&s=beauty&sr=1-453,2022-03-16 03:03:02.306944
B01IA96HYK,2022,3,16,body wash,10,21,73,4.4,19.40,0,0,1,1,0,0,0,0,0,0,0,8.4 Fl Oz (Pack of 2),"Thu, Mar 17",($1.15/Fl Oz),Eucerin Skin Calming Dry Itchy Skin Body Wash 8.40 oz (Pack of 2),http://amazon.com/Eucerin-Skin-Calming-Itchy-Body/dp/B01IA96HYK/ref=sr_1_454?keywords=Body+Cleansers&qid=1647370885&s=beauty&sr=1-454,2022-03-16 03:03:06.533925
B01BBR8X6S,2022,3,16,body wash,10,22,59,4.4,9.49,0,0,1,1,0,0,0,0,0,0,0,12.84 Fl Oz (Pack of 1),"Thu, Mar 17",($0.53/Ounce),Kracie Naive Body Wash Peach Refill Net Wt.12.84 floz/380ml,http://amazon.com/Naive-Peach-Kracie-380ml-Refill/dp/B01BBR8X6S/ref=sr_1_455?keywords=Body+Cleansers&qid=1647370885&s=beauty&sr=1-455,2022-03-16 03:03:10.736450
B07MVPNSD9,2022,3,16,body wash,10,23,89,3.6,12.20,0,0,1,1,0,0,0,0,0,0,0,13.53 Fl Oz (Pack of 1),"Thu, Mar 17",($0.90/Fl Oz),"Mademoiselle Provence Sulfate Free Organic Almond Body Wash with Orange Blossom Extracts, Vegan Natural Creamy Bath & Shower Body Cleanser, Nourishing Formula for Sensitive Skin, 13.5fl oz",http://amazon.com/Mademoiselle-Provence-Extracts-Nourishing-Sensitive/dp/B07MVPNSD9/ref=sr_1_456?keywords=Body+Cleansers&qid=1647370885&s=beauty&sr=1-456,2022-03-16 03:03:14.949523
B01MZ9I7YN,2022,3,16,body wash,10,24,576,4.7,7.29,0,0,0,0,0,0,0,0,0,0,0,0,0,($0.41/Ounce),"Dove Men+Care Elements Body Wash and Face Wash For Fresh, Healthy-Feeling Skin Charcoal + Clay Cleanser That Effectively Washes Away Bacteria While Nourishing Your Skin 18 oz",http://amazon.com/Dove-Care-Elements-Body-Charcoal/dp/B01MZ9I7YN/ref=sr_1_457_0b_fs?keywords=Body+Cleansers&qid=1647370885&s=beauty&sr=1-457,2022-03-16 03:03:19.158951
B01J81H6VM,2022,3,16,body wash,10,25,21,4.3,NOPRICE,0,0,0,0,0,0,0,0,0,0,0,16.9 Fl Oz (Pack of 1),0,0,"Kiehl's Body Fuel All-In-One Energizing Wash Hair & Body Cleanser foe Men, 16.9 Ounce",http://amazon.com/Kiehls-Since-1851%C3%82-Energizing-16-9-oz/dp/B01J81H6VM/ref=sr_1_458?keywords=Body+Cleansers&qid=1647370885&s=beauty&sr=1-458,2022-03-16 03:03:23.365137
B000I3Z39W,2022,3,16,body wash,10,26,4299,4.7,10.50,0,0,1,1,0,0,0,0,0,Save more with Subscribe & Save,0,5.3 Ounce (Pack of 1),"Tomorrow, Mar 16",($1.98/Ounce),Tea Tree Body Bar Soap 5.3 oz.,http://amazon.com/Tea-Tree-0009531115986-Body-Bar/dp/B000I3Z39W/ref=sr_1_459?keywords=Body+Cleansers&qid=1647370885&s=beauty&sr=1-459,2022-03-16 03:03:27.575991
B09D8SRB1H,2022,3,16,body wash,10,27,2,5.0,38.60,48.40,0,1,1,0,0,0,0,0,0,0,8.4 Fl Oz,"Thu, Mar 17",($38.60/Count),Necessaire The Body Cleanser (Bergamot),http://amazon.com/Necessaire-The-Body-Cleanser-Bergamot/dp/B09D8SRB1H/ref=sr_1_460?keywords=Body+Cleansers&qid=1647370885&s=beauty&sr=1-460,2022-03-16 03:03:31.784638
B06XFJT3P7,2022,3,16,body wash,10,28,1616,4.3,29.95,32.95,1,1,1,0,0,0,0,0,$26.96 with Subscribe & Save discount,0,8 Fl Oz (Pack of 1),"Thu, Mar 17",($3.74/Fl Oz),"Touch Keratosis Pilaris Treatment with 12% Glycolic Acid & 2% Salicylic Acid - AHA & BHA Exfoliating Rough & Bumpy Skin Body Lotion - Moisturizing Cream Gets Rid Of Redness, KP, Body Acne -8 Ounce",http://amazon.com/gp/slredirect/picassoRedirect.html/ref=pa_sp_mtf_beauty_sr_pg10_1?ie=UTF8&adId=A08972652Q2KMDAGEM1L4&url=%2FTouch-Keratosis-Treatment-Salicylic-Exfoliating%2Fdp%2FB06XFJT3P7%2Fref%3Dsr_1_461_sspa%3Fkeywords%3DBody%2BCleansers%26qid%3D1647370885%26s%3Dbeauty%26sr%3D1-461-spons%26psc%3D1&qualifier=1647370885&id=8179940487462329&widgetName=sp_mtf,2022-03-16 03:03:35.996810
B07BV5Z2CF,2022,3,16,body wash,10,29,1290,4.3,18.95,0,1,1,1,0,0,0,0,0,$17.06 with Subscribe & Save discount,0,6 Fl Oz (Pack of 1),"Thu, Mar 17",($3.16/Fl Oz),"10% Glycolic Acid Face Wash - Exfoliating, Non Drying & Foaming AHA Cleanser - Perfect for Anti-Aging, Skin Tone & Texture, Acne, Wrinkles, Pores, Blackheads - Sulfate Free, Oil Free, & Low PH - 6 oz.",http://amazon.com/gp/slredirect/picassoRedirect.html/ref=pa_sp_mtf_beauty_sr_pg10_1?ie=UTF8&adId=A0902424TEB82MW76Z4H&url=%2FGlycolic-Exfoliating-Drying-Foaming-Cleanser%2Fdp%2FB07BV5Z2CF%2Fref%3Dsr_1_462_sspa%3Fkeywords%3DBody%2BCleansers%26qid%3D1647370885%26s%3Dbeauty%26sr%3D1-462-spons%26psc%3D1&qualifier=1647370885&id=8179940487462329&widgetName=sp_mtf,2022-03-16 03:03:40.214640
B08LM864R5,2022,3,16,body wash,10,30,21327,4.8,14.85,0,1,1,1,0,0,1,0,0,$14.11 with Subscribe & Save discount,0,3.75 Ounce (Pack of 14),"Tomorrow, Mar 16",($0.28/Ounce),"Dove Skin Care Beauty Bar For Softer Skin Cucumber and Green Tea More Moisturizing Than Bar Soap 3.75 oz, 14 Bars",http://amazon.com/gp/slredirect/picassoRedirect.html/ref=pa_sp_mtf_beauty_sr_pg10_1?ie=UTF8&adId=A00394933KDQSN7OYEV18&url=%2FDove-Beauty-Softer-Cucumber-Moisturizing%2Fdp%2FB08LM864R5%2Fref%3Dsr_1_463_sspa%3Fkeywords%3DBody%2BCleansers%26qid%3D1647370885%26s%3Dbeauty%26sr%3D1-463-spons%26psc%3D1&qualifier=1647370885&id=8179940487462329&widgetName=sp_mtf,2022-03-16 03:03:44.422111
B0034L0B88,2022,3,16,body wash,10,31,221,4.1,21.99,0,0,1,1,0,0,0,0,0,0,0,"Sat, Mar 19","Sat, Mar 19",($650.59/Fl Oz),Agree Fragrance Body Soap 450ml,http://amazon.com/Agree-Fragrance-Body-Soap-450ml/dp/B0034L0B88/ref=sr_1_464?keywords=Body+Cleansers&qid=1647370885&s=beauty&sr=1-464,2022-03-16 03:03:48.631346
B0931QVHTZ,2022,3,16,body wash,10,32,1909,4.6,19.99,0,0,1,1,0,0,0,0,0,Save more with Subscribe & Save,0,5 Ounce (Pack of 4),"Thu, Mar 17",($5.00/Count),"Lume Natural Soap for Face and Body - Free from Parabens, Phthalates, and Artificial Dyes - Hypoallergenic and Safe for Sensitive Skin - Pack of 4 (Coconut Crush)",http://amazon.com/Lume-Natural-Soap-Face-Body/dp/B0931QVHTZ/ref=sr_1_465?keywords=Body+Cleansers&qid=1647370885&s=beauty&sr=1-465,2022-03-16 03:03:55.368202
B07ZZM6CKW,2022,3,16,body wash,10,33,576,4.6,11.26,0,0,1,1,0,0,0,0,0,0,0,16.9 Fl Oz (Pack of 2),"Thu, Mar 17",($0.33/Fl Oz),"Dove Gentle Exfoliating Body Wash, 16.9 Ounce / 500 Ml (Pack of 2) Imported from Europe",http://amazon.com/Dove-Gentle-Exfoliating-Ounce-Europe/dp/B07ZZM6CKW/ref=sr_1_466?keywords=Body+Cleansers&qid=1647370885&s=beauty&sr=1-466,2022-03-16 03:03:59.552779
B07JZFMPP1,2022,3,16,body wash,10,34,425,4.7,16.89,17.75,0,1,1,0,0,0,0,0,0,0,8.75 Ounce (Pack of 2),"Thu, Mar 17",($0.97/Fl Oz),Bath and Body Works 2 Winter Candy Apple Gentle Foaming Hand Soap. 8.75 Oz.,http://amazon.com/Bath-Body-Works-Winter-Foaming/dp/B07JZFMPP1/ref=sr_1_467?keywords=Body+Cleansers&qid=1647370885&s=beauty&sr=1-467,2022-03-16 03:04:03.769471
B002TSA90C,2022,3,16,body wash,10,35,4730,4.6,20.86,0,0,1,1,0,0,0,0,0,$19.82 with Subscribe & Save discount,0,4 Count (Pack of 1),"Thu, Mar 17",($5.22/Count),"Dove Men+Care Shower Tool For Stronger, Healthy-Feeling Skin Active Clean Scrubs and Exfoliates for a Deeper Clean With Body Wash, 4 count",http://amazon.com/Dove-Care-Shower-Active-Clean/dp/B002TSA90C/ref=sr_1_468?keywords=Body+Cleansers&qid=1647370885&s=beauty&sr=1-468,2022-03-16 03:04:07.973503
B0976FFVHH,2022,3,16,body wash,10,36,80,4.3,6.99,0,0,1,1,0,0,0,0,0,0,0,"Thu, Mar 17","Thu, Mar 17",($1.46/Ounce),"Naturelle ORGANICS All Natural Bar Soap for Man with Shea Butter and Activated Charcoal Face and Body Cleanser Bar (Activated Charcoal, 1 Bar)",http://amazon.com/Naturelle-ORGANICS-Activated-Charcoal-Cleanser/dp/B0976FFVHH/ref=sr_1_469?keywords=Body+Cleansers&qid=1647370885&s=beauty&sr=1-469,2022-03-16 03:04:14.861758
B00SD8J1WY,2022,3,16,body wash,10,37,164,4.8,7.29,0,0,0,0,0,0,0,0,0,0,0,0,0,($0.41/Fl Oz),"Dove Men+Care Body Wash and Face Wash For Fresh, Healthy-Feeling Skin Extra Fresh Cleanser That Effectively Washes Away Bacteria While Nourishing Your Skin 18 oz",http://amazon.com/Healthy-Feeling-Cleanser-Effectively-Bacteria-Nourishing/dp/B00SD8J1WY/ref=sr_1_470_0b_fs?keywords=Body+Cleansers&qid=1647370885&s=beauty&sr=1-470,2022-03-16 03:04:21.404902
B01BICMK6U,2022,3,16,body wash,10,38,3619,4.7,29.99,0,0,1,1,0,0,0,0,0,$28.49 with Subscribe & Save discount,0,12 Fl Oz (Pack of 2),"Thu, Mar 17",($15.00/Count),Defense Soap Body Wash Shower Gel 12 Oz (Pack of 2) - Natural Tea Tree Oil and Eucalyptus Oil,http://amazon.com/Defense-Soap-Body-Wash-Shower/dp/B01BICMK6U/ref=sr_1_471?keywords=Body+Cleansers&qid=1647370885&s=beauty&sr=1-471,2022-03-16 03:04:25.579679
B08WHTDCJX,2022,3,16,body wash,10,39,48,4.3,NOPRICE,0,0,0,0,0,0,0,0,0,0,0,15 Fl Oz (Pack of 1),0,0,SheaMoisture Men Body Wash Cleanser to Clean and Hydrate Skin Raw Shea Butter and Mafura Oil Moisturizing 15 fl oz,http://amazon.com/SheaMoisture-Cleanser-Hydrate-Butter-Moisturizing/dp/B08WHTDCJX/ref=sr_1_472?keywords=Body+Cleansers&qid=1647370885&s=beauty&sr=1-472,2022-03-16 03:04:29.802630
B00BG4MI3Q,2022,3,16,body wash,10,40,1805,4.5,NOPRICE,0,0,0,0,0,0,0,0,0,0,0,10 Fl Oz (Pack of 1),0,0,"Phisoderm Anti-Blemish Body Wash, 10-Ounce",http://amazon.com/Phisoderm-Anti-Blemish-Body-Wash-10-Ounce/dp/B00BG4MI3Q/ref=sr_1_473?keywords=Body+Cleansers&qid=1647370885&s=beauty&sr=1-473,2022-03-16 03:04:35.844972
B08L8GYW1F,2022,3,16,body wash,10,41,40,4.2,13.00,0,0,1,1,0,0,0,0,0,0,0,17 Fl Oz (Pack of 1),"Thu, Mar 17",($13.00/Count),Bondi Sands Body Wash | pH Balanced Formula Helps Prolong Your Tan and Gently Cleanses + Softens with Aloe Vera and Coconut,http://amazon.com/Bondi-Sands-Tropical-Balanced-Cleanses/dp/B08L8GYW1F/ref=sr_1_474?keywords=Body+Cleansers&qid=1647370885&s=beauty&sr=1-474,2022-03-16 03:04:40.036545
B07DRWVWJN,2022,3,16,body wash,10,42,3550,4.8,25.35,0,0,1,1,0,0,0,0,0,$24.08 with Subscribe & Save discount,0,24 Fl Oz (Pack of 4),"Tomorrow, Mar 16",($0.26/Ounce),"Dial Kids Body + Hair Wash, Bursting Apple Rapids, 24 Ounce (Pack of 4)",http://amazon.com/Dial-Bursting-Apple-Rapids-Ounce/dp/B07DRWVWJN/ref=sr_1_475?keywords=Body+Cleansers&qid=1647370885&s=beauty&sr=1-475,2022-03-16 03:04:44.290685
B00BHIU0N6,2022,3,16,body wash,10,43,71,4.6,NOPRICE,0,0,0,0,0,0,0,0,0,0,0,13.5 Fl Oz (Pack of 6),0,0,"Dove Men+Care Body & Face Wash, Deep Clean 13.50 oz (Packs of 6)",http://amazon.com/Dove-Care-Clean-13-50-Packs/dp/B00BHIU0N6/ref=sr_1_476?keywords=Body+Cleansers&qid=1647370885&s=beauty&sr=1-476,2022-03-16 03:04:48.503817
B08DC27GVC,2022,3,16,body wash,10,44,60,3.9,33.24,36.90,0,0,0,0,0,0,0,0,0,0,8.45 Fl Oz (Pack of 1),0,($4.16/Fl Oz),NÉCESSAIRE The Body Wash Sandalwood,http://amazon.com/N%C3%89CESSAIRE-The-Body-Wash-Sandalwood/dp/B08DC27GVC/ref=sr_1_477?keywords=Body+Cleansers&qid=1647370885&s=beauty&sr=1-477,2022-03-16 03:04:52.711915
B005Y2ASAG,2022,3,16,body wash,10,45,22,4.0,34.00,0,0,1,1,0,0,0,0,0,0,0,8 Ounce,"Mon, Mar 21",($34.00/Count),Annmarie Rosemary Peppermint Hand & Body Wash,http://amazon.com/Annmarie-Skin-Care-Rosemary-Peppermint/dp/B005Y2ASAG/ref=sr_1_478?keywords=Body+Cleansers&qid=1647370885&s=beauty&sr=1-478,2022-03-16 03:05:00.422045
B00MP7L6BI,2022,3,16,body wash,10,46,162,4.7,7.38,15.49,0,0,1,0,0,0,0,0,0,0,13.5 Fl Oz (Pack of 1),0,($209.07/Ounce),"Dove Men + Care Body Face Wash Clean Comfort 13.50 oz, 0.0353 Ounce",http://amazon.com/Dove-Care-Clean-Comfort-13-50/dp/B00MP7L6BI/ref=sr_1_479?keywords=Body+Cleansers&qid=1647370885&s=beauty&sr=1-479,2022-03-16 03:05:04.616607
B00C4AAJQ4,2022,3,16,body wash,10,47,128,4.6,8.99,0,0,1,1,0,0,0,0,0,$8.54 with Subscribe & Save discount,0,10.5 Fl Oz (Pack of 1),"Thu, Mar 17",($0.86/Fl Oz),"GIOVANNI 2chic Ultra Moist Body Wash, 10.5 oz. Avocado & Olive Oil, Creamy Hydration Vitamin Enriched Moisturizing Cleanser (Pack of 1)",http://amazon.com/GIOVANNI-Hydration-Enriched-Moisturizing-Cleanser/dp/B00C4AAJQ4/ref=sr_1_480?keywords=Body+Cleansers&qid=1647370885&s=beauty&sr=1-480,2022-03-16 03:05:08.845368
B00U0Z2AGM,2022,3,16,body wash,10,48,1341,4.6,13.99,0,0,1,1,0,0,0,0,0,0,0,16 Fl Oz (Pack of 2),"Thu, Mar 17",($0.44/Fl Oz),"Dial for Men Antibacterial Body Wash, 24 Hour Odor Armor 16 fl oz(pack of 2)",http://amazon.com/Dial-Antibacterial-Body-Wash-Armor/dp/B00U0Z2AGM/ref=sr_1_481?keywords=Body+Cleansers&qid=1647370885&s=beauty&sr=1-481,2022-03-16 03:05:13.058621
B01ETFFKYM,2022,3,16,body wash,10,49,58,4.3,6.75,0,0,1,1,0,0,0,0,0,0,0,"Thu, Mar 17","Thu, Mar 17",($0.90/Fl Oz),"TotalBath Skin and Hair Cleanser - 7.5 Oz - Full Body Shampoo and Body Wash Moisturizing Lotion - Enriched with Vitamin E - Ideal for Sensitive Skin, Rinse Free",http://amazon.com/Dermarite-Total-Bath-Cleanser-Ounces/dp/B01ETFFKYM/ref=sr_1_482?keywords=Body+Cleansers&qid=1647370885&s=beauty&sr=1-482,2022-03-16 03:05:17.266291
B074PV26LP,2022,3,16,body wash,10,50,20,4.7,19.99,0,0,1,1,0,0,0,0,0,0,0,12 Ounce,"Thu, Mar 17",($0.83/Fl Oz),"NASTY Prepare Body and Face Wash with Peppermint, Eucalyptus & Jojoba, 12 oz (Pack of 2)",http://amazon.com/NASTY-Prepare-Peppermint-Eucalyptus-Jojoba/dp/B074PV26LP/ref=sr_1_483?keywords=Body+Cleansers&qid=1647370885&s=beauty&sr=1-483,2022-03-16 03:05:24.012151
B08WCKRYG1,2022,3,16,body wash,10,51,36,4.6,11.00,0,0,1,1,0,0,0,0,0,15% coupon applied at checkout,Save 15%  with coupon,"Thu, Mar 17","Thu, Mar 17",($4.17/Fl Oz),"Terre De Mars Reddition Body Cleanser, Certified Organic, Low Foaming, and Moisturizing Body Wash for Men and Women, Infused With Coffee and Aloe Vera to Purify and Nourish Skin, Perfect for All Skin Types, Made in France, Vegan and Cruelty Free",http://amazon.com/Reddition-Cleanser-Certified-Organic-Moisturizing/dp/B08WCKRYG1/ref=sr_1_484?keywords=Body+Cleansers&qid=1647370885&s=beauty&sr=1-484,2022-03-16 03:05:28.205491
B01HP3DYLQ,2022,3,16,body wash,10,52,223,4.8,21.19,0,0,0,1,0,0,0,0,0,0,0,2.5 Pound (Pack of 1),0,($0.53/Ounce),"Neutrogena Rainbath Renewing Shower and Bath Gel, Pear & Green Tea (40 Oz)",http://amazon.com/Neutrogena-Rainbath-Renewing-Shower-Green/dp/B01HP3DYLQ/ref=sr_1_485?keywords=Body+Cleansers&qid=1647370885&s=beauty&sr=1-485,2022-03-16 03:05:32.412283
B082J8PC83,2022,3,16,body wash,10,53,517,4.5,19.77,0,0,1,1,0,0,0,0,0,Save more with Subscribe & Save,0,33.81 Fl Oz (Pack of 2),"Thu, Mar 17",($0.29/Fl Oz),"Dove Go Fresh Nourishing Body Wash, Cucumber and Green - 33.8 Fl Oz / 1L x 2 Pack",http://amazon.com/Dove-Fresh-Nourishing-Cucumber-Green/dp/B082J8PC83/ref=sr_1_486?keywords=Body+Cleansers&qid=1647370885&s=beauty&sr=1-486,2022-03-16 03:05:36.617216
B09G2S1KZ2,2022,3,16,body wash,10,54,16,4.1,36.00,0,0,1,1,0,0,0,0,0,Save more with Subscribe & Save,0,"Thu, Mar 17","Thu, Mar 17",($2.37/Fl Oz),"SALT & STONE Antioxidant Body Wash | Hydrating Gel Cleanser | Clean, Nourish & Soften Skin | Made with Niacinamide & Hyaluronic Acid | Free From Parabens, Sulfates & Pthalates (15.2 oz)",http://amazon.com/Antioxidant-Hydrating-Niacinamide-Hyaluronic-Pthalates/dp/B09G2S1KZ2/ref=sr_1_487?keywords=Body+Cleansers&qid=1647370885&s=beauty&sr=1-487,2022-03-16 03:05:40.816370
B0845D28ZY,2022,3,16,body wash,10,55,18437,4.7,19.96,0,1,1,1,0,0,0,0,0,$18.96 with Subscribe & Save discount,0,16 Ounce (Pack of 4),"Tomorrow, Mar 16",($0.31/Ounce),AXE Men's Body Wash for a Clean and Cool Feel Phoenix Dermatologist Tested Body Wash for Men 16 oz 4 Count,http://amazon.com/gp/slredirect/picassoRedirect.html/ref=pa_sp_btf_beauty_sr_pg10_1?ie=UTF8&adId=A07160233R5VSVOU3I89H&url=%2FAXE-Phoenix-Clean-Dermatologist-Tested%2Fdp%2FB0845D28ZY%2Fref%3Dsr_1_488_sspa%3Fkeywords%3DBody%2BCleansers%26qid%3D1647370885%26s%3Dbeauty%26sr%3D1-488-spons%26psc%3D1&qualifier=1647370885&id=8179940487462329&widgetName=sp_btf,2022-03-16 03:05:45.044646
B08XYBMPXH,2022,3,16,body wash,10,56,934,4.7,15.96,0,1,1,1,0,0,0,0,0,$15.16 with Subscribe & Save discount,0,10.1 Fl Oz (Pack of 4),"Tomorrow, Mar 16",($0.40/Ounce),Dove Nourishing Foaming Hand Wash For Clean and Softer Hands Aloe and Eucalyptus Cleanser That Washes Away Dirt and Germs 10.1 oz 4 Count,http://amazon.com/gp/slredirect/picassoRedirect.html/ref=pa_sp_btf_beauty_sr_pg10_1?ie=UTF8&adId=A0101332152EYM4QJDGHY&url=%2FDove-Nourishing-Foaming-Eucalyptus-Cleanser%2Fdp%2FB08XYBMPXH%2Fref%3Dsr_1_489_sspa%3Fkeywords%3DBody%2BCleansers%26qid%3D1647370885%26s%3Dbeauty%26sr%3D1-489-spons%26psc%3D1&qualifier=1647370885&id=8179940487462329&widgetName=sp_btf,2022-03-16 03:05:49.259573
